Language,Text
Sheng,Buda tuna-chill area.
English,"The product was to replace a previous unit I had and it worked just as well as the previous one. Only beef I had was the shipping was managed by Landmark Global and the delivery person just left the package outside the side door of my home - not even within the screen door of that entry, but outside on the driveway itself - very disappointed and disconcerting."
English,Excellent product. is a power full supplement when the racing for the long distances
Swahili,"Wasikunyakueni kutoka kwa baridi , kibarani , pepo za kaskazini na milima ya vosges , mizabibu ya alsace enjoy microclimate kwa ajili ya kuzalisha divai nyeupe ambazo , shikilia na divai maarufu zaidi ya bourgeoisie na bori ."
Kikuyu,Calcium ĩhothaga elektroni igirĩ na gutwika cation ina caji igirĩ positive.
English,"So disappointed in this product. Ergonomically it’s average efficiency, however be ready to get surprised non-performance when you really need to deliver. Since I’m a frequent traveler I like wireless gadgets but this one would deceive you right now when you are in need."
Sheng,Huyu boy ime-weza mtaa.
Swahili,D kwa pedestal .
Sheng,Arif wame-kam mashinani.
Swahili,Bado amebeba kwa jina lake la asili la krutenau ( mboga waterway ) .
English,"They work, but the silicone strap is very uncomfortable, if it had been a different material on that part I would give it 5 stars."
Kikuyu,'Andũ makwenda kũgũithia ndamathia'
Sheng,Arif ana-dai base.
Sheng,Rasta ana-zusha mashinani.
Kikuyu,Kĩharo kĩa mbere gĩekĩirũo njũng'wa-inĩ ya AMC Theatres thĩinĩ wa King Abdullah Financial District ya Riyadh.
English,"Good travel size toothpaste. After a 6 day trip -- it was stretching it -- but good travel size. If longer than 5 days, suggest bringing two."
Sheng,Buda tuna-chill downtown.
Kikuyu,City ya Nantong irĩ igũrũ mũno ta 2 m.
English,They don't hold an edge like they use to. I don't think they use good steel anymore. It's the old cheapen the product to keep the cost down.
English,The inside decals where coming off not even stuck to the house. Very cheap looking quality not that great!
Swahili,"Ofisi ya new york ya slate , ambapo jacob hung laptop yake ."
Kikuyu,"mabataro ma nyarĩrĩ maMũndũnĩ:Mĩhũũmũ, irio,maaĩ, thingira, matonyo na toro."
Sheng,Ma-dem ime-weza chuom.
Sheng,Manzi ina-bamba chuom.
English,"Fits very well and looks very amazing! The power button on the case broke, so I ordered another one"
English,If only they more sharper they would be perfect. My dog tolerates the sound its just that they aren't sharp enough to cut his hair. I say hair because he is a Yorkie.
Sheng,Msee tuna-chill base.
Kikuyu,Dongpingcounty irĩa nene yaChina.
Sheng,Manzi ana-dai area.
English,"I used this two times on one spot and it didn't turn the hair blonde. It stayed half dark, half coppery brown. For the price, it's not really worth it. It works about as well as any of the less expensive products."
Sheng,Arif ina-lapa mashinani.
Swahili,Na bila ya shaka wakati huo ulikuwa mwisho wa muda wangu .
English,"The sizes aren’t consistent, the gray and white fit perfectly and are comfortable. The black is a bit smaller but still comfortable. The nude straps seem shorter than the others and cuts a bit into my underarm. Side tags are bothersome as I have sensitive skin and I suggest them going tag free. They are a more comfortable option than underwire bra and look well under clothing."
Swahili,Lakini uh hadi sasa tumeweza kushikilia yetu kwa kujaribu kuweka bajeti ya kila mwezi
Swahili,Na uh kila wakati anataka kukata bajeti moja au kufanya kitu kingine au jaribu kufanya kitu unajua anaanza kupiga nduru wao kuchangisha kodi na na kata mipango yoyote na yeye kama nini. we jamaa unataka me ?
Swahili,Lakini kila mtu anafanya kazi na wao watoto wao siku ya kuzaliwa na kuondoka nao na sijui sitaki tu. sitaki watu usiowajua kulea watoto wangu .
English,Not strong enough to say attached. Sending back.
Kikuyu,Nigetha irute wĩra ũyũ nĩ citumagĩrathayathi ya ũhanĩkiĩria ĩthomagwo nĩ andũ metagũo Actuarians.
Kikuyu,Na njĩra nguhĩ nĩ maumĩrĩra ma wĩra wakĩbindo.
Sheng,Msee wame-kam kwa keja.
Swahili,"Hasa , inataka $ 90,000 kwa faili ya telegrams na barua imetumwa katika majibu ya hotuba maarufu ya nixon ya nixon ."
English,"I bought this in October and only used it a couple times to put up, and take down christmas lights. I take it out for the spring and I notice the top run has snapped off so it is swinging out. I expect more out of a ladder that is so expensive"
Swahili,"Kijapani ya kisasa , yeye , kuuliza na fomu ya archaic ya kikorea ambayo alichukua root nchini japani lakini alikuwa korea wakati wa karne kadhaa za kwanza ."
Sheng,Donda wame-kam chuom.
Sheng,Rasta ana-dai chuom.
Swahili,"Watetezi kama kwa kuwa upotevu ana mtu yeyote , lakini watoto wanakufa kila mwaka kutoka kwa sumu ya chakula ."
Swahili,I think my daughter aliongea mtu kwa carolina ni nini hiyo ni shule juu hapo that uh
Sheng,Rasta tuna-chill kwa matha.
English,"This thing worked okay the first time after they basically fall over every time I try to put my boat on top my Element. The racks are nothing but frustrating to use so your money is better spent on something more useful. The worst part, I was trick into buying them by the five star reviews. Only to discover after I received this item, they bribe you into giving them a five star review with “free” gift."
Kikuyu,Cenita ici itethagia kambuni na gwataniro kwĩhariria nĩgetha iga thegea mĩaka ĩgoka.
Kikuyu,Green herb like njegeni but edible.
Kikuyu,Kenya nĩ mbogo nyingĩ cĩa githakaini no gűtiri cia műciĩ.
Kikuyu,"Ndurumeni ĩrarũmĩrĩra Ray, ũrĩa arĩ mũmbirarũ atana-ikio njera na rĩoho rĩa mĩeri 18 na ihĩtia rĩa kũũraga comba."
English,A friend had sunburn on her back after the first day of being out in the Hawaiian sun. Applied this at night and she felt immediate relief and minimal pain the next morning. I recommend putting it in the fridge to add an extra relief when it is applied.
English,"I could have given a zero star. The product is a waste of money and the service is pathetic, I accidentally ordered the same product twice and they would not allow returns."
Sheng,Buda ana-zusha chuom.
Sheng,Manzi ame-hepa downtown.
Sheng,Buda ime-weza downtown.
Swahili,"Na mimi don na sababu i ni kwa sababu nina gorbachev na mshauri wake ni mimi kwa sababu ilikuwa ni nikita khrushchev naamini najua ni moja ya shule ya zamani ya zamani na uh he is a , . ni marxist leninist kikomunisti kupitia na kupitia"
Swahili,So well i think it ' s just going to take it ' s just going to take a lot of education and a lot of time and like i said i was just umetisha at how at how easy ulikuwa unajua i tu ' t
Swahili,Baadhi ya ushahidi kuwa kuwa wtp ili kuepuka hatari ya kifo cha mrefu iliyohusisha mateso na kupoteza utu na udhibiti wa kibinafsi ni mkubwa zaidi ya wtp ili kuepuka hatari ( ya ukubwa identical ) wa kifo cha ghafla .
Kikuyu,njũthĩrĩria na mathomo ma mĩgendere na mawĩki ma mũigĩ nĩ ĩguũrĩtie maũndũ ma bata harĩ ũtaũkĩri wa mbũgĩ cia kĩrĩndĩ.
Swahili,"Katika uwanja huo huo ni tofali wa story tatu magnificent wa san machale , ajili mwaka 547 ."
Kikuyu,"Thegi ya mĩnyamario ĩno, Ray nĩekorire matiemano-inĩ ma ngũũĩ ya kĩndũire marĩa macacĩte gatagatĩ ka ma makundi ma Kĩarabu na ma Aborijini."
Sheng,Rasta ame-omoka tao.
Sheng,Msee ime-weza kwa matha.
English,"Product was too bulky to when trying to install, after market springs are too thick for hooks.... Rods are too long.. but for stock applications it should be good.. use the maximum motorsports spring tool if you are dealing with mustangs..."
Sheng,Buda ana-zusha area.
English,"Initially it covered the tree just fine.. not too thick, used 2 cans to cover two small birch trees - however, 24 hours later the whole thing came off - it almost evaporated!!!!!:( . this is not a good product."
Sheng,Ma-dem ame-omoka mtaa.
English,I just don’t believe these 5 stars reviews anymore. I adore fantasy and there were some nice beats in this book and an interesting main arc - but it all gets buried by too much bloat. There is really only about 200 pages worth of material here. Even that material is basic chosen one beats big baddie. Waaay too many side characters that were pointless. Random POV shifts - as in telling the exact same moment from two or three points of view for no reason other than to add pages to the book. A frankly stupid and unexplained magic system. Somehow PG (no cursing or sex or even food or use of bathrooms) but with R levels of violence and torture. Tone was also extremely serious and desperately needed some humor and levity. Such a self serious slog at times. Please don’t believe the 5 star reviews. This book is below a average fantasy inflated with too much redundant filler.
Swahili,"Kupiga mbizi na snoring ni mambo ya kufanya hapa , na nyumba ya maji ya shimmering baadhi ya maisha ya bahari ya ajabu ."
English,Great for protecting the back of my seats. I have them on backwards so the pockets face the seat. I had one for a couple of years and it worked great! So i bought two more to protect my other seats.
Kikuyu,Panamabũrũri waAmerika ya Kuthini.
Sheng,Manzi ina-lapa base.
English,"makes you think, eye opener"
Kikuyu,Mwana wĩna mĩtugo mĩega nĩ ũhũthũ kũmũtaara na kũmũcokia njĩra ĩrĩa yagĩrĩire ũkĩringithania na mwana wĩna mĩtugo mĩũru.
English,This order of bleach never came. I do love the Pure bright brand
Kikuyu,Chirchiqcity irĩa nene yaUzbekistan.
Kikuyu,Aarĩ Mũtabarĩri wa Ngumo wa World Future Council.
Kikuyu,"AciarĩirũoIsiraeli, na akĩrererwo Ngeretha kuuma arĩ na mĩaka 13."
Kikuyu,Icicio igariũraga  njĩra ũtheri na mũkunga wĩna mũruna mũkaranu na njĩra ĩiganaine na ũrĩa ũtheri ũrathiĩ.
Swahili,"Hata hivyo , uwezo mkubwa wa underutilized wa ng ' ambo will vifaa vya tayari vya tarajiwa , ambayo will kuweka kiwango cha bei huongeza kwa kiwango zaidi ."
Kikuyu,kĩhooto kĩa mũngiki(mob justice) nĩ kĩururĩrio nĩ athuthuria mabũrũri-inĩ taKenyanaGhana
English,"I ended up returning this not because it was a bad product but just because it wasn't what I needed. It's great for straightening if you have the talent oh, it's right for curling too. I'm just not so savvy about that stuff"
Kikuyu,Canganyinĩndorothiya kũnyugutwo na kũbĩrĩrĩka ĩthondeketwo kaingĩ na ngora ya mũnyore na ũraihu wa cientimeteri 20 nginya 25 na mũromo wa kũhurũka.
Sheng,Msee ina-bamba downtown.
Sheng,Manzi wame-kam base.
Kikuyu,"Mweri wa 1984, nĩ aheo kĩheo kĩa Right Livelihood Award nĩ ũndũ wa ""kũgarũra ngarari ya ecology ya Kenya ĩtuĩke ya kũiga mĩtĩ ĩngĩ""."
Sheng,Huyu boy ame-doz mtaa.
Kikuyu,City ya Hinesville irĩ igũrũ mũno ta 23 m.
English,I’m 5’7 and these are great except I expected them to be a bit longer and tighter at the bottom. They are slightly above my ankle and get looser about three inches above the bottom hem. I think the material is quality and great I just wish they were longer.
English,"I am not sure if this product is working, i have used for two nights and there are no bugs trapped on the sticky board...maybe my home is pest free of flying bugs!"
English,"An interesting, easy read. Beautifully written."
Kikuyu,Bururi wa Kongowĩ thiinĩ yaAbĩrika.
Sheng,Karao ime-weza kwa keja.
Swahili,That ' s true coz i think wanaenda kuhama arizona wakati
Swahili,Yeye watuhumiwa kitu .
Sheng,Manzi ame-hepa kwa matha.
English,Wrong color i purchased a silver set i received black also no bracelet unsatisfied with purchase.
Sheng,Ma-dem ame-doz area.
Kikuyu,City ya Cairo irĩ igũrũ mũno ta 23 m.
Sheng,Ma-dem ina-lapa kwa keja.
Swahili,"Take , na utapata safari vizuri zaidi ."
Sheng,Manzi ame-hepa kwa keja.
Sheng,Donda ina-lapa kwa keja.
English,"I think it's working. However, I have also gotten two cats and am still setting out D-Con. I've seen a couple of mice since buying it - some recently. Maybe I need more units. The one I have is in my kitchen - near the D-Con - and I see NOBODY has nibbled on the D-Con......what in the world do they find to eat in the bedrooms?"
Swahili,"Inasemekana , tabia kama hizo za kudai ngono kutoka kwa wafanyakazi wenza ili kulazimisha mfanyakazi wa ofisi ya kike ili kuitumikia chai au kusafisha eneo la kazi ."
Swahili,"Kuna wachache hiyo na baridi , unajua umeme na maji ya moto na kwa hivyo kuna wachache wa hizo na lazima make nafasi yako vizuri zaidi mapema"
Swahili,"Kipindi cha cover cha muda ya kamati ya kuokoa dunia : katibu mkuu robert rubin , naibu katibu lawrence summers , na mwenyekiti wa hifadhi ya shirikisho alan greenspan ."
English,My wife liked her case. She said to bad the stars didn't glow in the dark.
Kikuyu,"Nĩ eetagwo ""Mwarĩ-wa-Mũthamaki wa Afrika"", na kwa ihinda rĩa mĩaka 20, nĩ ahetwo ũrigithathi mũkũikũ-inĩ wa nyĩmbo cia Afrika ya Mũhuro."
Kikuyu,Mīaka-inī ya 1950s terebiceni nīyo yarī mūtambo ūrīa wahūthīkaga mūno gūkinyīra mūingī.
Kikuyu,Brazil kwaragio ruthiomi twa portugese na nogwo bururi thĩinĩ wa Amerika ya Kuthini waragio portugese.
Kikuyu,Ceceni ici niihotithitie mũndũ o wothe wa rũrĩrĩ gũkorwo agikinyirwo ni maũndũ ona atekũmenya wega thiomi in5gi.
Kikuyu,"Watho wa thiomi wa Latvia ũkoragwo ũgĩtĩrĩnga rũthiomi rũrũ ta ""mũrũmbũ wa kĩndũire gĩa tene gĩa rũthiomi rwa Kĩlatvia""."
English,Grandson loves it !!!
Sheng,Rasta ina-lapa kwa keja.
Kikuyu,"Kaingĩ nĩ mĩthangiri ya nyamũ ta ngiri, nguũ, onanjogu."
Swahili,Yes i ' m fortunate in that nilikuwa na uwezo wa kuchukua mapema retirement kutoka kwa kampuni yangu mwaka jana na kuweza kufanya hivyo nilikuwa na uwezo wa kuweka bima yangu ya afya ambayo kampuni pays ambayo na ilibidi pick bima ya maisha yangu mwenyewe .
Swahili,"Akasema : je , hivyo mimi ni katika walio amini ?"
Kikuyu,Ngonyanĩ mũthako wa ititika rĩa hakuhĩ ũthakagwo nĩ mĩahũ erĩ cia athaki ikũmi na ithano kana mũgwanja.
Sheng,Msee ina-bamba area.
Sheng,Karao ana-zusha area.
Kikuyu,Amerika ya thondekirwe mwaka 1776 ni makoloni 13 ma Uingeretha
Kikuyu,Mũhianĩre wa mũbira nĩ gĩtumbĩ.
Swahili,Lakini i sasa kuwa baadhi ya makazi ambayo wazee wa zamani ambao wanaishi hapo na au ulihama au chochote
Swahili,"Kwa mwaka wa fedha 2002 , vba iliyobadilishwa mipango yake ya utendaji kwa ajili ya watendaji wakuu katika ofisi za mkoa ili kuboresha uwajibikaji wa kibinafsi kwa kuunganisha malengo ya utendaji wa shirika na utendaji halisi kwa vipengele vya maana na yanayopimika vya utendaji ."
Sheng,Rasta ana-zusha mtaa.
Kikuyu,Maciaro ma mũti ũyũ nĩ marĩ batathingithũ-inĩcia ũyahundi naũkiricitiano.
English,No big deal. Just looks different.
Swahili,( mkutano wa marekani si kwa kiasi kile waandishi wa habari wa marekani ni kufanya act kwa chuki zao -- safu ya habari na wakati wa hewa abudu kwa flytrap wange isipokuwa waandishi na wahariri amini tuhuma hizo .
Sheng,Rasta ime-weza base.
Sheng,Msee ime-weza area.
Kikuyu,Kambĩ karĩ na itiema rĩa keerĩ mbere ya kabĩ na thutha wa kĩĩga macũmbũrano-inĩ mamwĩrĩ.
Kikuyu,City ya Chirchiq irĩ igũrũ mũno ta 582 m.
English,They look great. They're gentle and delicate.
Kikuyu,"O na kũrĩ ũguo, nĩ kuonekaga atĩ andũ arĩa maarutaga wĩra hamwe nake nĩ maataũrĩte Kĩrĩkanĩro gĩa Tene."
Swahili,Ni wewe unajua van alafu lustbader b a d e r
Sheng,Buda ime-weza job.
English,"Great quality , only used it twice but seems perfect and easy to clean"
Kikuyu,Mĩkawa mĩingĩ Bũrũri wa Kenya ĩrugaga mĩkando (mũno mandathi) hamwe na cai kana kahũa.
English,"For the price, this cardigan will suffice. It's not made of sweater material, it's more like a weird t shirt. I suspect it might fall apart in the wash but it'll get me at least one wear."
English,"Looks good, like a nice piece of furniture. Sturdy, drawers roll nicely. So much better than the old metal cabinet we had before. Nice to keep paperwork you want to hold onto organized."
Sheng,Buda ina-lapa area.
Sheng,Manzi ame-hepa base.
Swahili,Va ya kwa ofisi ya habari na udhibiti wa mambo ya udhibiti ya udhibiti ya udhibiti ambayo ilivyofafanuliwa sababu ya marekebisho kwa kanuni zilizopo za va na pia ikapatikana gharama na budgetary athari za utawala .
Kikuyu,Îri na andú Milioni magana mathatu koguo ni ya kathatu nthí íría ina andu engí mûno nthi ngima.Ní nthi ya búrúrí 50 na Washington DC.
Sheng,Msee ame-hepa chuom.
Swahili,Kama kuna baadhi ya kusikiliza
Swahili,"Mashirika mengi kukosa tamaduni za shirika hiyo utendaji wa juu na uwajibikaji , ambayo ni muhimu kwa mashirika ya mafanikio ."
Sheng,Donda ana-zusha tao.
Sheng,Ma-dem ame-doz job.
Sheng,Arif ana-dai kwa keja.
English,The rubber string inside the 4 legs are so tight that my dog looks so uncomfortable wearing it so I cut all the rubber strings out and sew it back on and now it is perfect rain coat for my dog
English,The beefiest Selfie Stick I have ever seen!!! They have thought of everything with this. 1. Rechargeable battery USB cord supplied 2. Selfie Stick adjustable lanyard supplied 3. Selfie Stick velvet carrying case supplied 4. Operates using Bluetooth
Kikuyu,Ũndũ ũrĩa nĩ ngũrani na mĩimbo ĩngĩ ĩrĩa ĩtathegeaga.
Kikuyu,City ya Xiantao irĩ igũrũ mũno ta 31 m.
Sheng,Buda ina-bamba chuom.
Kikuyu,"(Kingeretha okay, oh!,M-hm, huh?"
Kikuyu,kaingĩ ihandagwo thegi wa mũboco ikatheremania hamwe.
Kikuyu,Bukharacity irĩa nene yaUzbekistan.
Sheng,Ma-dem wame-kam chuom.
Swahili,The fat man alitabasamu
Kikuyu,Nĩ atongoretie ũthaki wa mbica mĩrongo ĩtandatũ na nĩ onĩkanĩte thĩinĩ wa mbica makĩria ma igana rĩmwe na mĩrongo itano.
Sheng,Ma-dem ana-zusha area.
English,"Correct part, but this is my third one. The plastic becomes brittle and comes apart clogging the filter"
Swahili,Fanya sahihi hasa na
English,One of the cartridges didn't work
Swahili,"Ireland ana tangu mara ya zamani sana , lakini historia ya irish huanza sana na kuwasili kwa kelba katika karne ya 6 b.c. , uvamizi wa kwanza wa kumbukumbu ."
Kikuyu,ũcuumi wa Brazil nĩgwo mũnene mũno thĩinĩ wa mabururi ma Amerika ya kuthini.
English,Pants are cute but huge on waist and cant be adjusted. A bit disappointing.
Kikuyu,mũhari nĩKĩrema (object)kĩaMũthunũrũrio (geometry)kĩrĩa kĩrĩ kĩũga kĩa rũriika rũmwe (one dimensional).
Sheng,Msee ana-zusha downtown.
Swahili,Lakini wewe kuwa rahisi sana kubisha nchi hii na mashirika yake makubwa kwa aina ya falsafa ya left ya left bora alionyesha kwenye kibandiko cha bamba wakati huna hata bamba !
Sheng,Rasta ame-doz chuom.
Swahili,"Pamoja na hoja zote za kulazimisha mmetoa katika aya ya mwanzo , ingekuwa ni ya kipuuzi na khiana ili wanasisitiza kuwa"
Swahili,"But i ' m proud though that that you know i , in the miaka and back then it was popular you know but watu na sana unajua kuwa wise kuhusu madawa na"
Swahili,Ca ' daan mnapokaa ya kijivu
Sheng,Huyu boy ina-bamba tao.
English,The watch screen doesn’t register the touch after you install this. Huge waste of money.
English,I like that these are bright enough to see and not so bright they blind everyone
English,"This wasn’t that expensive but regardless it’s only been a week since I’ve owned it, I haven’t pulled or dropped it for it too already be falling apart. The strap that hold the case together is already coming off the seams and it’s going to start looking dirty and worn out. Literally only been a week."
Swahili,We ' re seeing the coroner na daktari kwanza .
Kikuyu,City ya Nukus irĩ igũrũ mũno ta 76 m.
Swahili,Juxtaposition hii ya ya ya serikali ya vyeo 16-na majengo ya karne ya 17 ilikuwa mara moja ya viwanja vya soko la moor .
English,didn't work after about 2-3 days.
Sheng,Mbogi tuna-chill area.
Kikuyu,Liupanshuicity irĩa nene yaChina.
Kikuyu,Mũciĩ mũnene wa Mbocinia na Hecengobina nĩSarajevo.
English,Hooks are rusty and not high quality. This is nice if you are building a tackle box for friends or family who you don’t want using your nice gear. That’s why I bought it. The lures have stickers on them instead of being painted.
Sheng,Donda ana-zusha job.
Sheng,Msee ana-zusha kwa keja.
Sheng,Buda wame-kam mashinani.
Sheng,Msee wame-kam tao.
Sheng,Rasta ina-bamba area.
Kikuyu,Kwĩ mabururi mariagwongimaya Mĩanga.
Sheng,Msee ime-weza chuom.
English,Bought this for the wife...she tried it on some chips and had to through away the whole batch. Said the cheese tasted old and stale. Very disappointing.
English,The flash drive is good but at times the Sandisk Memory Zone app on Android devices is unable to detect the drive.when inserted. Works good on PC. It gets detected if you delete the above app. The app needs improvement and must be able to continuously play music rather than just playing what is been clicked one after the other.
Swahili,Akasema : labda !
Kikuyu,araarire mũcumbĩkiro wa mabataro ũũ.
Kikuyu,Calciumnĩ Erementi ya Cuma ya gikundi kia cuma cia thĩ Alkalaini.
Sheng,Manzi ame-omoka mtaa.
English,It worked pretty well. I didn't see a ton of difference at first but in combination with a tablet featuring bleach it finally got rid of most of the disgusting gunk in my toilet. It still isn't clean enough to eat out of but it's much better.
Kikuyu,"Maathai aaciarirũo mũthenya wa 1 mweri wa gatano mwaka wa 1940 mũciĩ-inĩ wa Ihithe, kĩrainĩ kĩa Nyeri, bũrũri-inĩ wa Kenya."
English,"This product does help with dry skin. However, I didn't care for the scent or the consistency. I'm sure it works well for others, just not with my personal taste."
Swahili,Lakini kuna tofauti sasa
Sheng,Msee ana-dai mashinani.
Sheng,Arif wame-kam area.
Swahili,"Asubuhi , wakati uchovu wake na bado analia mke ilianguka amelala kwenye bafu la locked , profesa amechoka jumamosi kwenye sofa , na kusema mwenyewe :"
Sheng,Rasta ime-weza tao.
English,"Assembly from the kit. Poor finish. But, there is no complain, because I guess the price detect the quality look of it. Picture looks good but its appearance is poor in reality."
Sheng,Huyu boy ina-bamba downtown.
Swahili,"Ikiwa watu wengi wanaishi miaka mingine hamsini baada ya chuo na iwapo chuo gharama jumla ya $ 100,000 , basi ngono ya ziada , na wanafunzi wa chuo juu ya wenzao wa shule ya juu ni katika heidi fleiss kuhusu $ 1,000 kwa kila ."
English,"I’m trying to quit smoking and this seemed like a good aid to help me do it. Flavor is great and I will probably buy more in the future. However, my pen only lasted about two days. I got it Friday and by Sunday afternoon it ran out of battery. I’ll be on the search of something similar but longer lasting."
Swahili,"She katika cuny - shule ya sheria tofauti zaidi nchini humo - na , ndoto yake miaka mitano iliyopita ."
Swahili,"' ' yeye ' ' doc ' ' doc ' ' doc ' ' ' ' ' ' , ' '"
English,"I purchased this item with the hopes of using it in a small laundry room. Compared to others on the market, it seemed to be priced just right, especially considering it looked halfway decent. But considering its size, I knew it would have some limitations. Let's start by saying that, yes, this product did do what it is designed to do - after an hour of running in my kitchen I noticed some water had begun to form in the collector. Knowing that the product now worked as advertised I proceeded to unplug the dehumidifier from the wall so that I could move it to my laundry room; but when I touched the plug to remove it from the outlet, I was met with an unfortunately familiar feeling - the sensation of burning. I quickly removed the plug from the wall and allowed it to cool down for a half-hour before testing it again in the laundry room to see if the plug would heat up as it did in the kitchen. Now, mind you, I read through the reviews for this product beforehand and didn't notice anything of concern initially, but it was at this point that I looked back at the reviews again - and found that there were other instances of plugs getting too hot, burning, and melting. Now, the product had been plugged in again for all of five minutes, so I decided to see how the plug was faring this time around. Sure enough, the plug was SCORCHING HOT, even after just a few minutes. The smell of melting plastic filled the air, and my fingers were left slightly burned. Now, I beg of you, DO NOT BUY THIS PRODUCT - IT IS A FIRE HAZARD! Amazon, please cease to offer this defective hazardous product. I've never left a review before, and I've purchased hundreds of products on here - please, look at other dehumidifiers (as I am now doing) as this product undoubtedly has the potential to cause a fire, and thus potentially untold damage to both property and life."
Kikuyu,Nĩ harĩ 'ngũkũ ya njamba na mwera nĩ ngũkũ ya nga'.
English,"Great strings, but should be labled."
English,These are extremely thick and is very noticeable. Doesn't really adhere to the edges. I'm very disappointed with these. Will have to purchase different ones that fix better from a different brand
Swahili,"Wakati kuwa huduma ya posta inafaa kutumia zaidi kuhusu masomo ya gharama , maswali simama kuhusu fedha wa sekta binafsi katika eneo hili ."
English,Short and to the point
Sheng,Buda ana-zusha kwa matha.
Swahili,I ' m so yangu yangu yangu yangu yangu yangu yangu yangu yangu yangu yangu yangu yangu yangu yangu yangu yangu yangu
Swahili,Asilimia 6 kama matokeo ya vitendo vya kudumu vya kudumu .
Kikuyu,cirũ wa gp aciarirwo ta mary wanjirũ wa kĩarie mwaka-inĩ wa 1983 koinĩ-inĩ ya kĩambu.
Swahili,hunt ! drew ikabidi kwa kama johnny shannon alisimama mbele yake katika kiingilio imara .
Sheng,Huyu boy ana-dai tao.
Swahili,"Sanamu ya mlima , bibi yake wange , alikuwa ni titan wa kulala na should ca ' daan au dada zake make kelele usiku , titan wange na wavuma na kuua nusu ya dunia ."
Sheng,Buda ina-lapa kwa matha.
