Language,Text
Swahili,"Baada ya kuona sevilla juu karibu na mitaa ya cobbled , majengo , kifumbu ya stork katika uendeshaji wa belfries au kuchukua daladala katika mto adaja kwenye monument iitwayo cuatro postes ( machapisho manne ) ."
English,Not as comfortable as I thought it would be.
Kikuyu,Andu a mabururi ma muhuro wa abirika metaga Johannesburg Jobegi.
Sheng,Arif ame-hepa kwa matha.
Sheng,Donda ina-lapa job.
Sheng,Mbogi tuna-chill mashinani.
Kikuyu,Andũ a marika ma nahau kabere magakĩũria ciuria kumana na motaaro na maũgĩ marĩa marakĩrutanwo thaa ici.
English,has no clear screen protector
English,"Perfect, just what I was hoping for. Very bright."
Swahili,Chache za miili zipo kwenye display .
Sheng,Karao ame-hepa job.
English,Lasted about a month and a half before it ripped
English,Very pleased. Great variety and fabulous customer service. Rings are comfortable and true to size. Will order again if they hold up long term.
Swahili,Well i really enjoy reading the newspaper we get the daily and dallas morning news and i try to look at it if i get busy i don ' t get a chance to pick it up kama wiki hii i noticed nakala kadhaa na na lakini uh
Sheng,Mbogi ana-zusha job.
Kikuyu,Mũtaratara wa kũruta wĩra wa kũruta mabuku no ũhũthĩre:
Sheng,Huyu boy ame-omoka base.
Kikuyu,"mabataro ma karungo ga gatatũ nĩ: kwĩrica itanya-inĩ rĩna, kwĩyata na kũganwo nĩ andũ"
Sheng,Mbogi ina-bamba mashinani.
Swahili,Um-hum yeah right ni gari aina gani
English,I bought this product 10 months ago and last night the gasket on the water tank failed and I woke up to a kitchen covered in water. It seems that the Capresso coffee makers (which I have bought for years) have become less reliable.
English,It broke...I went to return and it is 2 days past the month for return date...only used 3-4 times and the pole already broke...pretty sad quality...
Kikuyu,"Nĩ ũndũ ũcio, ũrũaru ũcio nĩ wagomeire na njĩra nene mũno harĩ atumia na ciana."
Swahili,Mashirika hayo yanaanza kwa kutathmini kiwango ambacho programu na shughuli zao huchangia kukutana na lengo lao na matokeo ya taka .
Kikuyu,Tűyamű tűnini tűkoragwo na magűrű matadatű ta thigiriri na műthűa.
Sheng,Huyu boy ina-lapa chuom.
Kikuyu,"wonjoria,Ũteti, na wĩtĩkio(ndini) nĩ imwe cia iharo iria mathomo ma mbũgĩ cia kĩrĩndĩ itonyaga."
Swahili,"Elegance ya ikulu inakuwa wazi tu katika eneo la ndani , na ngazi zake saba za turreted na handsome za handsome ."
Kikuyu,Changzhoucity irĩa nene yaChina.
Kikuyu,Cĩtĩ ikoragũo imanja cia iwanda cia tekinoronjĩ cia ũhoro.
Sheng,Donda ina-bamba chuom.
Sheng,Buda ime-weza mtaa.
Sheng,Arif ana-dai mashinani.
English,Great case if you drop your phone a lot. It will protect it! Downside it’s really big & bulky. I often put my phone in my back pocket & it didn’t fit very well. Also the coloring of my jeans came off onto the case causing it to discolor & look dirty.
Sheng,Donda ina-lapa chuom.
Kikuyu,Rĩu kũrĩ mwaka wa 2017 nowĩrorere ceceni nyingĩ mũno ũrĩ gũkũ bũrũri-inĩ.
Swahili,Nadhani kiugooriginal unajua unaweza kuwa na mikopo yako ya chuo kucheleweshwa sasa kwa sababu nilikuwa yao kwa sababu nimerudi katika shule ya kuhitimu miaka thelathini na moja .
Kikuyu,"Ciana cia thikũ ici maita maingĩ irekora igĩcaria kĩrĩra kuuma ihumo ingĩ ta thimũ, arata aa marika mao ona karabiceni-inĩ."
Swahili,"Kabla ya hapo , alifanya kazi kwa huduma za cambridge na somerville huduma za kisheria , kulingana na cambridge , na kwa ajili ya servces wa kisheria wa massachusetts kwa katika"
Sheng,Karao ame-omoka chuom.
Kikuyu,"Thoome-inĩ ya wonjoria cia kũruta,kĩhũndanĩ itĩna rĩrĩa arutwo na aciari ao mathiaga kũgũra indo cia mathomo na nguo cia mwaka wa cukuru."
Sheng,Mbogi tuna-chill kwa matha.
Swahili,Na kwa kweli kwani kwamba haikuwa uzingatiaji wetu wakati sisi ilikuwa ni jambo tupu sana wao hata nyumba na tulikuwa mpya kwa mchakato huu mzima na wote sisi ni kwamba ni nyumba rahisi ambayo hii kavu maendeleo uh hivyo ni kuwa nzuri sana na
English,Cable works great! Connected a Lenovo laptop to a DVI input monitor without any difficulties.
Sheng,Msee ina-lapa base.
English,Good for the price. Dog chewed it up in one day though. Will buy stainless steal next time. If available.
English,"kinda big and long earring, cute and great quality!, loved it!"
Kikuyu,"Kĩrathi kĩa nobero, Ngűthuguthia na guthima kwotamu thithitemu nyene, Royal swedish Academy of sciences 2012."
Swahili,"Vyombo vya habari na cans vya wastani , yakini kwamba masuala haya ni udhaifu wa chama na kwamba hoja zake za kiuchumi ni nguvu zake , na maneno ya bush kama kukemea kwa republican puritanism ."
Kikuyu,Zhuozhoucity irĩa nene yaChina.
Sheng,Ma-dem ame-hepa downtown.
Swahili,"Mbinu hiyo alikuwa na wafanyabiashara wa ashfaka miaka 1,000 baadaye katika ? do anatolia , wapi ilikuwa qui ? sk ? áy kuwa na watu wa kienyeji hatti , ambao , katika eneo hili , tayari na tangazo ? Ϳzanced jimbo la ustaarabu ."
English,At first. Like seriously what kind of book is this. Then wow.. bravo... bravo.... seriously this is an amazing book.
Swahili,Masinde alikuwa ameona baadhi ya picha za brando na kuamua alihitaji kuzungumza na muigizaji wa fetsa kuhusu uzito wake .
English,Love the variety and pups seem to enjoy!
Swahili,"A alikuwa na chakula-tips , alipata oro cruz , mmoja wa migodi tajiri katika milima ya tubacca ."
Sheng,Donda ame-doz mtaa.
English,"The fit of these shoes feels a bit wide. They slide a bit when I wear them with trouser socks, but feel fine with a thicker wool like sock. Close up they look a bit more old fashioned then the pic suggests. I kept them, but I would not buy them again."
English,Nice and sturdy. Well made. Great value!
Sheng,Ma-dem ame-doz base.
Swahili,Viwango vya mifumo ni muhimu kwa mashirika ya blouse blouse na kuchora au kurekebisha mifumo ili kuchukua faida ya pita ya teknolojia .
English,Love the kettle so much I purchased a second one. Wish this vendor was Prime. Ordered white version and received ORANGE so have to waste my time dealing with return.
Sheng,Msee tuna-chill area.
Sheng,Karao wame-kam chuom.
Kikuyu,Hinesvillecity irĩa nene yaUSA.
Swahili,"Ofisi ya uhasibu ya jumla , kudhibiti faida inayoibuka kutoka kwa matumizi ya utendaji wa utendaji , gao-01-115 ( washington , d. c . : oktoba 30 , 2000 ) ."
English,Does what it is supposed to do.
Sheng,Huyu boy ana-dai mtaa.
Swahili,"Richard brown alitoa maoni juu ya gharama za juu za juu zinazohitajika ili kuendeleza teknolojia ya teknolojia ya kuwasilisha huduma hizi , kama vile uchunguzi wa kompyuta ."
English,"Everything was great,no problem with delivery etc...Ordered a few other things,outside the packaging I'm extremely pleased with the products...Will def be using again."
Swahili,"( unaweza kupakua toleo la jaribio la ie4 sasa , iwapo unataka . )"
Swahili,"Watch him , so yeye kwa mshtuko akiamka"
Sheng,Arif ime-weza base.
Kikuyu,Dashiqiaocity irĩa nene yaChina.
Swahili,Hakika haya ni katika miujiza ya mwenyezi mungu . ' vile harland alikuwa looking-the ibada-ni almost .
English,"Not worth the money. Missing light and metal edges were distorted and bent. Hardware was also missing. Update, Glove seam split open second time using it. This is junk!!!!!"
Sheng,Msee ame-doz kwa keja.
English,"This came noticeably second hand, already opened and taped over. Very disappointed."
Kikuyu,"Aidara nimahigorira ceceni cia radio Mozdahir FM kou Dakar, na ceceni ya radio Zahra FM kou Kolda imwe cia radio Senegal."
Sheng,Rasta ina-bamba downtown.
English,The watch looks good but the clasp is impossible! I tried to coax and adjust it so it would hold but there was no way it would work. The clasp makes a slight click when it closes but it will not lock the band on your wrist. The watch continually fell off.
Sheng,Rasta ame-hepa job.
Swahili,Dunia ni mahali salama sana sasa kuliko ilikuwa miaka mitatu iliyopita .
Kikuyu,Mũciĩ mũnene wa Lado warĩ gĩcogi ya Lado.
English,Be careful of the center clip and dont push it too much or the plastic might crack
English,"I am allergic to cocoa, and dairy and gluten. Finding this bar was a chocolate lovers dream! It really tastes like a chocolate bar! To be sure, I had a chocolate eating friend try it and she liked it too."
Swahili,Kila mara naweza tikisa dereva macho kwa dharura ya kweli. madume '
English,Said it would fit my truck and it didn't...and it was too late to return.
Swahili,Tovuti ya mtandao wa gao ( www.gao.gov ) ina taarifa za abstracts na fulltext za taarifa za sasa na ushuhuda na nyaraka za kupanua za bidhaa za zamani .
English,"The book started out well and then just went on and on and on....... and never quite got to the point until I just quit reading it. I got to about 60% of the way and simply could not continue. I see where others have simply skipped ahead full chapters to get to the last 15% of the book. By the time I gave up my interest had simply disappeared. Too bad, could have been written in a much more concise and interesting format."
English,"lasted six months of very light use before the fuse blew. Apparently this is a common problem with this model, and repair is costly. Just stopped working in the middle of cooking a quiche. NOT happy at all. Won't buy another one."
Sheng,Msee ame-doz chuom.
Kikuyu,Ndagũrĩti nĩ indo iria itarĩ cia mwene iria igĩhoota kũgĩa mwene.
Sheng,Donda ina-lapa base.
Swahili,"Kama kwenye visiwa vya kitropiki zaidi , mwendo wa maisha huendeleza kuwa mvivu ."
Swahili,"Katika majadiliano juu ya ufanisi wa matangazo ya kupambana na madawa ya kulevya , carlson ( gang gang ) anasema , i madawa yoyote tangu nikaona kuwa tangazo la aliyepaa pan ."
Kikuyu,"Njĩra ya bara ĩmwe ĩna ũraihu wa  kilomita1,860 kilometres (1,160mi)na ĩrũgamagĩrũo nĩ ndamathia ya Tanzania-Zambia Railway Authority (TAZARA)."
Kikuyu,Nĩ ĩthiũrũrũkaga na mũlaini wa Iqweta.
English,"It was bought for my 14 years old phone, he loves the color and the case in general. I am a little disappointed that there is not more screen protection, just don't make them anymore."
English,Just what I was looking for bath time
English,When arrived serveral keys were already broken. However otherwise it’s a pretty good beginner keyboard.
English,they look and feel plastic and large for a slim ankle
Kikuyu,Nokuo mũndũ arutagwo mĩtugo ĩrĩa ĩtĩkĩrĩkĩte rũrĩrĩ-inĩ.
Swahili,"Ni nini zaidi , kiwango cha ndoa cha white-black bakia kwa kiasi kikubwa zaidi ya viwango vya white intermarriage na nyingine , mbio za nonblack ."
English,This is how my product came!
Swahili,"Ngozi ni bidhaa maarufu , ingawa nadra sana ; jaribu tel aviv ."
Swahili,Na hakika wao wamo katika watu wa mbali .
English,Deep clean for sensitive skin. I have used it for one time only every day.
Swahili,"Sasa , don , bi er cowley ."
Kikuyu,Kűmenyekana kwa atomu ni kwahotithirie gűthondekwo gwa atomĩki thiori ĩria yatumĩrirwo gűthondeka  periodic table.
Kikuyu,ngũkũ(Gallus domesticus) nĩ mũthemba wa nyoni iria cirĩithagio nĩũndũ wa nyama ciao na matumbĩ.
Sheng,Donda ana-dai area.
English,just ok. inner plastic curtain keeps falling off the hooks.
Kikuyu,"wahota kwanjiria ũndũ ũkũhigũrĩre mieke, ta kwanjia kiwanda gia  guthondeka mĩnyore ũgĩe na mweke wa gũthondeka iraĩ cia pracitiki."
Sheng,Rasta ime-weza downtown.
Sheng,Mbogi ame-hepa mashinani.
Swahili,"Nyumba ya cottages karibu na upwa , anyongwe kama makazi ya watu wenye ofunika kubwa , ni ndani ya maji ; baadhi ya kuja na maji ya moto ."
Kikuyu,Ngari mĩthemba mĩeruNgari cia thitima.
Swahili,Kukatika kwa bajeti na programu za michezo katika shule nyingi za mjini .
Swahili,' we can ' t pitia hiyo madume '
Sheng,Ma-dem ame-omoka job.
English,Great product but returned because u need to be smarter then they say to understand
Swahili,Milioni 7 katika nyakati za los angeles na zaidi ya dola milioni 3 na makaratasi mengine makubwa .
Sheng,Karao ina-lapa base.
Swahili,Bajeti baadhi ya muda ni hisia ya kawaida ya mtindo wa maisha ambayo iliyofafanuliwa sehemu hii ya jiji kwa ajili ya miaka 300
Kikuyu,City ya Binzhou irĩ igũrũ mũno ta 20 m.
Kikuyu,Ciandarũa no ithondekwo na rangi o wothe kũhũthĩrĩa theũruma ngũrani.
English,"Everything worked as it should, the motion detection, solar charging, worked great! I just don't see where they would be able to be used, you need bright big light for outside. THese are solar powered soo.. You do the math :)"
Kikuyu,City ya Shangqiu irĩ igũrũ mũno ta 50 m.
Kikuyu,ta hihi ciana ciathukurumatha ma kũhurũka(break time) nĩ ci rimũthaga hatarĩ na mũtaratara.
Kikuyu,"Kiugo ""njekĩma"" kiumanĩte na 'nje' kiugo gĩa mũrimũ wa maithoNjereri;naNgĩma."
English,Only two per package. Wish I had known that. Otherwise very cute.
Swahili,"Kutoka basi mpaka 1812 , wakati swiss uswisi explorer john l. burckhardt rediscovered petra , ilikuwa karibu kabisa sahau ."
Swahili,Unamaanisha nini ? yeye mwanaume mara mbili size yake
English,Love it. Great support and stays in place perfectly.
English,"I am so disappointed with this seller. I have ordered this order THREE TIMES. One out of the three times i got the right part. ONE! I had to return that weird piece once already, and now the same thing happened. I dont even know what the problem is but i wish if the seller saw this could do something about it because it is ridiculous at this point Do not buy from here"
Kikuyu,Mũtitũ mũnene muno na uria uteithagia kwagiria riera.
Swahili,Cha uyakwazi .
Sheng,Rasta ime-weza chuom.
Sheng,Mbogi ina-bamba area.
Sheng,Donda ana-dai downtown.
Sheng,Msee ina-lapa mashinani.
Sheng,Ma-dem wame-kam area.
Kikuyu,"Cia mathako ni ceceni taSelect Sport, Blitz, Select Sport 2, SS9 East,SuperSport 9naKwese Free Sport."
English,It says this can hold up to 300 lbs so i bought it. Didnt float at all when used in saltwater.
Sheng,Huyu boy ame-doz kwa keja.
Sheng,Arif ana-zusha base.
Kikuyu,Ĩmwe ya nyĩmbo ciake nĩkoragwo ũugũrĩrĩio-inĩ wa thinema ya 2004 ĩtagwo 'HotelRwanda'.
Kikuyu,Hithitori ya tekinoronjĩ cia ngari ni:
Kikuyu,City ya St. Louis irĩ igũrũ mũno ta 142 m.
Kikuyu,City ya Kraków irĩ igũrũ mũno ta 188–383 m.
Sheng,Karao ame-hepa base.
Swahili,"Cummins , kiongozi wa mauzo ya dunia katika injini za diesel zaidi ya 200 horsepower , kwa ufanisi hutumia mifano kuhakikisha kuwa ubunifu huo ni imara na anaamini katika thamani ya prototyping katika maendeleo ya bidhaa ."
Swahili,"Utu wa msingi wa mtu ni na jinsi yeye katika dunia hii , au iwapo mtu mwingine anaweza kuwa na dna sawa ."
English,I like the fact that this one came with the pump but the pump was a cheap quality and broke only a few days after I purchased it and I've now purchased three of these tubs and they probably only lasted a month most before they started getting holes and popping
English,"Great switches if you know you have a common wire in your existing switch. Aesthetically, it looks much better than other brands. Fairly easy to install, assuming you have a common (white) wire available. If you don't, its easier to go with the smart bulbs and group them together in your app. 4 stars until the price is more reasonable."
Kikuyu,Lianyungangcity irĩa nene yaChina.
English,Very cute hat and glove set but did not fit my 3 year old. It fit my nephew who is 11 months old.
Sheng,Huyu boy ame-doz tao.
Swahili,Aliens katika kategoria imezuiwa mara kwa mara kisheria nchi wakati wa kozi ya uwakilishi wao .
English,"Love the case ,the price is so lovely"
English,"Very good read. I liked the premise and the characters. The book kept my interest engaged from beginning to end. Unfortunately, I found the climax to be a bit of a letdown. While it was exciting, I felt like the final showdown should have been a more personal confrontation between the heroine and the villain. Still, I highly recommend it, especially if you like the Steven King style of horror novels."
English,"Nice candles, they're made of real wax/look real. They were a good deal price-wise. My only two issues.. The remote does not work on them. It's not a huge deal as you can turn them on/off manually from the small switch on the surface of each candle, where the batteries go in.. Also, this being my first experience buying flameless candles like these.. When you go with a darker color (VS White /Cream/Ect), the white 'flame' is very visible/obvious during the daytime/when not in use. That part looks very 'fake-y', if that bothers you. But overall, a good price for the real wax look, the amount of candles you get, and how they look when they're lit. Very nice."
English,great sneaker. very comfortable...I ordered a shirt to match..great price. shipping came in 2 days..I love them..
Swahili,Ordination .
Swahili,"Je , kuna kikundi kuja kutoka kwa mmoja wa benki juu ya hospitali ya watoto ambapo nilikuwa na kujitolea na uh walikuwa wanafanya mada na kila mmoja wa vijana wa execs coming walikuwa hasa wanaume na wanawake wote walikuwa na jacket ya kijivu. na suruali za kijivu au _ au sketi na blauzi nyeupe na tai ya rangi hiyo yaani unaweza kuwaambia wanawake kutoka kwa wanaume isipokuwa kwa urefu wa suruali ."
Kikuyu,City ya Yan'an irĩ igũrũ mũno ta 975 m.
Swahili,"Precipitous toba lead wa chuo kikuu cha paris , strategically tumezingatia ili kufuatilia volkeno ya pelee ."
English,I never got this product
Sheng,Huyu boy wame-kam kwa matha.
English,no need to get under the edge of the toilet.
Swahili,"Katika kona ya mercaderes na obispo ni renovated ya hivi karibuni , hotel ya enzi za 1920 ambos mundos ; heai aliishi na kuzima chumba cha 511 kwa miaka kadhaa wakati wa miaka ya 1930"
Kikuyu,Alhaji Muniru Mohammed Limuna – mũnini wa ũrũmbũiya thayũ
Swahili,"Curragh na punchestown racecourses wapo hapa , na stud wa taifa , nyumbani kwa akielevuka stallions , ana baadhi ya farasi wenye mafanikio zaidi nchini humo ."
Swahili,Hiyo labda will
Sheng,Buda wame-kam kwa matha.
Kikuyu,Mũciĩ mũnene wa Kongo nĩBrazzaville.
Swahili,Mafanikio yao ni halali na majimbo yao ni .
Sheng,Msee tuna-chill job.
Sheng,Buda ana-zusha mashinani.
Sheng,Donda wame-kam downtown.
English,It was soft before i sewed it in and lovely for the first week of sew in . Then it started to shed a little more and have knots. Reacts well to flat iron and holds curls with product. Not the best but its ok.
Swahili,"Vii ya alisema , ni workmanship hiyo ."
English,Thinner then I thought used as dog collar and puller apart not very happy for what I needed them for.
Sheng,Manzi ana-zusha downtown.
Swahili,Msisitizo imebadili kutoka mbinguni hadi kwenye ardhi .
Sheng,Ma-dem ime-weza mtaa.
Swahili,Mauzo ya bidhaa ya bidhaa na huduma kwa mfuko mwingine kuliko mfuko wa marejeo .
Kikuyu,Gwĩ thimo nyingĩ itũmagĩrwo Abĩrika yothe.
Kikuyu,Hengyangcity irĩa nene yaChina.
Kikuyu,City ya Dengta irĩ igũrũ mũno ta 44 m.
Swahili,Mfano mmoja wa jinsi sisi mbinu hii ya observer ya mshiriki ilikuwa katika utafiti wa ggd wa huduma zinazopatikana kwa ushuru kutoka ' baada ya ' pungua idadi ya mawakala wa habari za umma
Kikuyu,Nĩ ĩhũthĩrĩtwo ta kĩndũ gĩa gũkumutha na gũtheriaNyũngũo hamwe na indo cia mbaũ na igera na kũnyorokia thiũ.
English,Only a three star rating on this machine. My doctor isn't sure I should be using it.
English,Product doesn’t work for my watch??!
English,"Don't really care for this bird bath, it leaks."
Kikuyu,Hindi iyo nirio TV iria nene chiaregire kumemerekia ihinda ria thiku karundo makiregana na mibango iyo.
Swahili,"Tiketi za makumbusho ya uskoti kuruhusu kiingilio pia kwa mikusanyiko kuu ya makumbusho ya kifalme , kutimiza lengo la curators la kuleta uskoti duniani , na ulimwengu wa scotland ."
Kikuyu,Meihekoucity irĩa nene yaChina.
Kikuyu,ici nĩ ingituma wira uthuthuke ta watho wa thirikari.
Swahili,I saw one i thought i ' m crummy with that ' s a huh
Sheng,Manzi tuna-chill tao.
Swahili,Vikosi vya gpra a shift katika lengo la mashirika ya shirikisho-mbali na wasiwasi kama huo wa jadi kama staffing na viwango vya shughuli na kuelekea matokeo ya overriding moja .
English,"Cool looking backpack, has many pockets for stuff, light weight and durable, perfect for travel"
Swahili,"Naam , hiyo inategemea"
English,The bottle as depicted was different in what was received although the contents were the same. Need more time to evaluate the results
English,"Nice quality, the selection of sizes are nice.. it's make wearing one much more comfortable."
English,"Shipping took longer than I expected, but i dont blame the seller. I havent tested it in the field so i dont know how it will last but it is SUPER comfy and really easy to put on. I will report back after a few days in the woods;)"
English,"This would be fantastic- the idea is great. However, the way it unfolds and sits on the toilet, my kid's bum gets pinched sitting on it. It was a waste of money for us, I tossed it."
Sheng,Rasta ana-zusha chuom.
Sheng,Manzi ame-doz base.
Swahili,"Chakula hiki cha nutritionist na kitamu kipo kwenye moyo wa mlo mlo , na utaweza kununua kwa ukubwa wote ili kuchukua nyumbani ."
English,Is very nice and comfortable.
English,"We have used Frontline for years for flea and tick prevention. However, this summer it has not worked on fleas. I have made 2 applications, followed instructions, and our cats still have fleas. Not sure if their formula has changed or if it's the weather, but I have purchased a different brand of drops formulated only for fleas. We'll see if we have better luck with that."
Swahili,"Birahimbaye wa nguvu katika kaskazini make nyumbani kwa ajili ya cava , mmoja wa miungu ya hindu hindu zaidi ."
English,"It was surprisingly hard for my to find slippers that fit on like a shoe, so when I found these I was excited! They cute, unique, and rather comfortable to wear. They keep my feet warm without making them sweaty (which is always a plus!). Lots of people have seen me wearing them and have complimented on how cute they are and asked where I got them. XD"
English,"Using this at my entry door in the garage which is connected to a lamp light. Working good so far and it picks up the my movement every time. The only thing is, i wish it had a 30 second timer. It does have a 4 second timer which is good for testing. Anyway, i set the timer to 1 minute which is next lowest time. I do recommend this product though."
Sheng,Donda tuna-chill tao.
Sheng,Donda ana-zusha mtaa.
Swahili,"Katika viwanja vya galatasaray , ambapo istiklal caddesi hujua kwa haki , njia ya chuma ya chuma yaliyo na kiingilio ya karne ya 19 lisesi , cee ya franco-kituruki ( shule ya sekondari ) ambayo elimu majina mengi makubwa katika kisasa historia ya kituruki ."
Sheng,Donda ame-doz job.
Swahili,"Nadhani ni kuhambiwa sababu kwa matibabu yako ya mtaalamu , doc ."
Swahili,"Licha ya utangulizi wa teknolojia ya kisasa , hata hivyo , bonde hilo baki jamii ya kilimo kimya tucked katika baadhi ya milima ya kisiwa cha island ."
English,Functional. Quite smooth. Low quality finish with silk screen printing peeled off when received. Knob on the handle can get loose and fall off.
Swahili,And i mean that kind of mashangao i mean you know coz once oil get so unajua thick and shucky you ' d wonder how they could know clean that up kutosha tena lakini wanaweza
Sheng,Karao ina-lapa chuom.
Swahili,"Sec anaamini kuwa faida ya utawala yanazidi gharama kuhusishwa kwa kuwa ni kwa kiasi kikubwa cha kanuni kwa kuondoa vizuizi vya biashara kwa ajili ya underwriters ya usalama kikamilifu , kupunguza vipindi vya waliozuiwa kwa ajili ya usalama wengine , toa mfumo rahisi zaidi kwa miamala ya aliwakasirisha , kupanua huduma stahiki kwa ajili ya soko la nasdaq earned wakati wa kutoa sadaka za haki za deregulating ."
Kikuyu,Űũgi nĩta mũbũyũ Ngũtirĩ mũndũ ũgĩ ũhĩbĩria
Swahili,Ni pande hii sir
Sheng,Arif ame-hepa kwa keja.
English,I have been using this pot everyday for about a month now to steam baby food and veggies. It has been very durable so far. Seems like good quality as well.
Kikuyu,Gĩĩko kĩu nĩ kĩmemerekirioKameme-inĩkĩa twitch.
English,"Excellent case. Literally had my phone run over by a steam roller, and it just cracked the screen."
Swahili,"Natumaini sio egotistical ya kwamba wakati makala ya , sema , jamhuri mpya , i karibu kila mtu ambaye anaweza kuwa na maslahi ndani yake ."
English,Grandkids really enjoy dressing up. Bright colors
Sheng,Rasta ana-dai mtaa.
Kikuyu,ũiira nĩUugekana ũrirũ ũrĩa ũrekegio nĩ mwendekithia wamũrũgamo (proposition)mũna ena itanya rĩa kũonia ũrũngaru warĩo.
English,"I read the reviews, but didn't think it would happen to me because I'm careful. The zipper broke as many other reviewers noted and this is such a disappointment . This a gorgeous back pack of nice quality. Wish they put a quality zipper in it, too. Think twice before you order because now I'm on the hunt for someone to repair it which will drive the price up even further!"
Sheng,Ma-dem ame-hepa kwa keja.
Sheng,Mbogi ina-lapa mashinani.
Sheng,Arif ana-zusha kwa matha.
English,"We were initially very pleased with the product. It is challenging to remove the lid when hot. We were using the antlers/head of the moose because it was easier to access. After about 3 weeks of use, one of the antlers came off in my hand when removing the lid. I had purchased through Amazon and they offered a full refund (after Plow & Hearth initially said they would not refund my money or replace the product)."
Swahili,Amekaa sourer kufikiria sisi ndani yake. scout glanced kutoka kwa mmoja kwa wale vijana wa young .
English,"Not at all his best book. It bordered on the absurd at times. Sorry, I’m typically a big fan."
