Language,Text
Swahili,"Kijapani na zoezi la asili la kichina la ranking vituko na maeneo , na korakian ni moja ya bustani tatu kubwa za japani ."
Sheng,Huyu boy ana-zusha kwa keja.
Swahili,Iwapo mchakato wa tathimini kwani kwa rfp shirika hilo anaendesha hatari kubwa ya maandamano yenye mafanikio kwa kupoteza wauzaji .
English,"The brackets are nice enough and perform as expected, but the labels on them were nearly impossible to remove. They look like the brackets were sitting in the warehouse in the heat and labels really adhered to them. I was able to remove them, but it took a while because they would only come off a tiny piece at a time."
Sheng,Ma-dem ana-zusha chuom.
Swahili,Msingi wa sayansi ya taifa .
Swahili,Miongozo hii walikuwa kwa programu ufadhili na lsc kupitia kuachiwa kwa mfululizo wa barua za programu na uga mwingine correspondences .
Sheng,Mbogi ana-dai job.
Sheng,Arif ina-bamba base.
English,The fit on this is extremely nice. It fits true to size. I like the way it holds everything in place while making you feel sexy. Extremely comfortable to sleep in as well.
English,I really love the color. I put a popsocket on it which makes it really nice to handle. Unfortunately the slot that you put cards and gets stuck. So I have to take the whole thing apart to take any cards out which makes it very inconvenient.
Kikuyu,"O ho, Kamagĩra nene ikuaga makari, ndaba hamwe na agendi."
Kikuyu,Shuanghecity irĩa nene yaChina.
English,Runs quiet but cuts close - and never cuts my neck!
English,I would have liked this product if it wasn’t all busted up when I received it. It was dented and scratched and nearly impossible to get the taped up plastic off the wand
Swahili,Talk taabu na balaa ...
Kikuyu,ũratuthũkire thutha wa mbica ciraonanagia mũndũ mũirũ akĩhihinywo ngingo na mũthigari kũrungũka nenda-inĩ.
Kikuyu,Tathirikari kugiria kindu githondekwo
Sheng,Rasta ina-bamba tao.
Swahili,"Alikuwa karibu miaka 200 iliyopita ( nadhani pengine na david ricardo ) , ili kufafanua mfumo wa awali wa nchi ya viwanda nchini uingereza , ambapo wakulima wange mchunge mifugo yao katika nchi , kwa kawaida ."
Sheng,Mbogi ame-hepa job.
Sheng,Arif wame-kam downtown.
Swahili,Idadi ya wazee wa marekani-wale wenye umri wa miaka 65 na zaidi-inakua na akaunti kwa ajili ya kusambaza kwa jumla ya idadi ya watu ( tazama figure 1.6
English,Very cute. Great wedding gift. Doesn't look cheap or flimsy.
Swahili,Bustani ya grove mwanamke akamjibu mfululizo wa maswali ya kuunda na kuchapisha fomu ya faili na mahakama .
Swahili,"Muhimu zaidi , vikundi vikuu ni kile pollard kwani ."
Sheng,Mbogi ime-weza area.
English,"This series is full of wizards (light and dark), magic and hope, and has a satisfying conclusion, although not a HEA. The characters will still be with you long after you turn the last page. I found myself looking for (and finding) the rest of the story."
English,"Looks just like the photo, only complaint is it came w some spots of something on it"
Sheng,Ma-dem ana-dai job.
Kikuyu,City ya San Salvador irĩ igũrũ mũno ta 658 m.
Swahili,"Wa , wa , wa , sir"
Kikuyu,>>andũ othe nĩ macokaga gũkua (andũ nĩ nyakua)-kĩrica kĩa mbere
Kikuyu,Ciandarũa ikoragwo na mĩthaiga ya mĩthemba ngũrani ĩhũthĩkaga kũthaga ũthiũ wayo.
English,We have an arts center and use the chalk to write on a board which we set outside so people know we are open. The chalk is great and easy to use. Cleans up like a charm
Sheng,Msee ame-doz downtown.
Swahili,Kwa kazi ya yadi yard
Kikuyu,"Famĩlĩ yake nĩ yaKikuyu, gĩkundi kĩa andũ aingĩ bũrũri-inĩ wa Kenya, na nĩ maatũũraga kũu kwa ihinda rĩa njiarwa nyingĩ."
Kikuyu,Maundu maria biacara kana mundu ena ũhoti wa gwika wega
Kikuyu,City ya Ji'an irĩ igũrũ mũno ta 62 m.
Sheng,Rasta ame-hepa tao.
Swahili,..........................
English,"The jacket is too short. Yes, I'm 6'2"", but I followed the conversion chart."
English,Both bottles arrived with broken caps. They arrived shrink wrapped together but shrink wrap had already been cut open on one side. The seal on the bottle on the open side was half off. Not happy!!
Kikuyu,City ya Hanzhong irĩ igũrũ mũno ta 511 m.
Kikuyu,Firosofa ũria wa thondekire uria ciambiki cia thayathi icenjagia.
Sheng,Arif ame-hepa job.
Swahili,"Michoro yake comprise picha ya rembrandt van uylenburgh , tarehe mwaka wao ; hieronymus bosch katika kutisha yake zaidi ; kukusanya tajiri wa goya rasmi , michoro ya kuvutia ya maisha halisi , na haunting matukio ya wachawi na africans ; el greco ' s nyeti st. francis wa asizi na mapema ( 1562 ) picha kutoka kwa kipindi chake cha venetian ; na vichapishi wa kiingereza reynolds , gainsborough , na constable ."
Swahili,Yeah and and so um but but ukienda kuagiza drink salad unajua vizuri unasema they ' re i don ' t know it ' s uh
English,Best cold mask for migraines I have purchased and I purchased two of them. Disappointed though; one seems to stay colder for longer than the other even though they are identical.
English,Have only used this product for a few days but can already see a temporary difference as so far when the product completely absorbs then I still see the same wrinkles. Am hoping that time will give a different result and wrinkles will lessen.
English,This is the only product that I’ve found that holds my iPhone 10 with otter box. Great product.
Kikuyu,Jiaozhoucity irĩa nene yaChina.
Sheng,Arif ime-weza kwa keja.
Kikuyu,Cirũ wa gp(shiru wa gp) nĩ mũinĩ wĩna ngumo mũno waNyĩmbo cia kĩgooco.
Sheng,Ma-dem tuna-chill downtown.
English,had to return as it didn't fit my gun
Kikuyu,City ya Poznań irĩ igũrũ mũno ta 50-154 m.
Kikuyu,"- **Johnny Nasser** ta Mazen, mwoho mũkarĩ"
Kikuyu,nĩ kũrĩ na mĩhĩrĩga ya thukuru ici kuma cia kothi cia moko(technical college) ginya mũmũrũmwe(university).
Sheng,Msee ana-zusha chuom.
Kikuyu,Nĩ mumera wa mũti utarahiga mũno.
English,Just as shown. Very nice.
Sheng,Donda ame-hepa mtaa.
Swahili,Pia wao na kusema mambo kama mimi ni stickler kwa katiba .
English,So first off it was kinda to hard getting my phone properly in the case then the screen cover is loose on the screen so i have to apply extra pressure on my screen to navigate my phone and lastly the case literally makes it impossible for anyone to hear hear you on calls the case muffles out your voice so i have to be wearing a headset or have my phone connected to a bluetooth device and my phone still got cracked while wearing case.
Kikuyu,ũyũ nĩ ũtitika wa ndereti kana igongona hatarĩ namawathokana mĩtugo mĩkaru ĩrĩa no mũhaka ĩrũmĩrĩrwo.
Sheng,Manzi wame-kam kwa matha.
Sheng,Karao ina-bamba downtown.
English,Not a shirt for me.. not everything looks good on everybody
Swahili,Ndio pengine huna joto sahihi na mambo pengine sio watu wengi sana kula huko aidha inaonekana kuwa aina ya genes ya kusini
English,"I bought the filter to deal with the iron in our water, which stains the shower. It reduced the amount of rust, but does not eliminate it and I still need to use a rust removal cleaner on the shower."
Kikuyu,City ya Shijiazhuang irĩ igũrũ mũno ta 83 m.
Kikuyu,"Kwĩ mabũrũri nyamungumi nyendetwo mũno ta Amerika, Jaabani, Korea, China, Ngeretha na mangi maingĩ."
Sheng,Rasta ame-doz tao.
Kikuyu,"Thĩinĩ wa Amerika ya matĩ (Mesoamerica), mbembe nĩ ĩtuagwo ngai ya ngano na ĩgathondekwo icunjĩ-inĩ."
English,Container was sealed but only half full very disappointed!
English,Does not stay attached to back when open. Felt on inside attracts lint and pet dander
Kikuyu,"Nĩ kũrĩ na mĩbebe mĩthemba ngũrani ta nyamũthaka, nyamũkũũ na  njerũ."
Kikuyu,"Kiirikanaga ni kiri uteithio hari marungo, na no kihoorerie murimu wa marungo (arthritis)."
Swahili,"Je , will ?"
English,Just as listed. very nice pillow covers
English,Works as advertised. Will put it to the real test in next few weeks to find out how long the battery lasts when fully charged and used in ordinary functions sans hooked up to power
Sheng,Buda ime-weza kwa keja.
Sheng,Buda tuna-chill mtaa.
Sheng,Manzi ame-omoka kwa matha.
Kikuyu,ColombiaBururi wa Amerika ya Kuthini.
English,Just opened this. Was NOT packaged properly and arrived broken! So not happy.
Swahili,"Alikuwa na nafuu ya ajabu sana , na nema hata unaonekana ."
English,Stopped working after 30 days.
Sheng,Arif ame-omoka mtaa.
Kikuyu,Ciandarũa ĩhũthikaga marungũro-inĩ ma manganda na ma wonjoria ta mĩkawa o hamwe na mĩciĩ.
Swahili,"Naam , economists don mitindo yao na maoni yao kama wao umri wa zamani ; mundell alibadilisha zaidi ya zaidi ."
English,Zero complaints after 3 days of use.
Swahili,Sure wamepata pesa yako already !
Sheng,Huyu boy tuna-chill kwa matha.
English,"My first nice projector. 2800 lumens makes the projection work pretty well even in the daytime. Speaker is good enough thus not necessary to connect with external speakers. Very beautiful pure white color. We use it for home entertainment, perfect for kids to have a party or a home movie to pretend in the theater. Easy to connect with my phone, ipad, laptop and portable DVD player, very compatible. Worth buy."
Swahili,Lakini kwa kweli serger kuonekana kitaalamu
Swahili,"Swim ni katika maporomoko ya maji ya jeriau , 41.2 km ( maili 2 ) kaskazini mwa mji ."
English,Really disappointing quality
English,"The video quality and features are better than expected at this price but the mounting system is junk. In the heat of the sun the plastic gets soft and loses the grip on the camera mount. This makes the camera prone to falling out of the attachment point from the suction mount. Another problem with the camera not being firmly secured is the resulting ""jello"" video from the vibration of driving."
English,These screen protectors do not last long and the edges lift easily. I went through 2 protectors in 3 months and wonder if the panes are actually tempered.
English,I never received this product and had no communications back to me either. Not a happy shopper
English,"I guess my review of realistic and others is very different, but truly I don't like this one."
Kikuyu,Yangi Mirishkorcity irĩa nene yaUzbekistan.
Sheng,Rasta ame-omoka kwa matha.
Swahili,Sayansi ya kisiasa
English,The wheel cover match the others perfectly but was a little tight to get on
English,Really cool. 4th and 5th ones owned and gifted!
Kikuyu,Edward Kofi Omane Boamah – Mũthĩgĩ wa ũrangĩri
Sheng,Karao ina-bamba base.
English,"Not easy to clean , bad product."
Kikuyu,Andu aya ni David wineland na Serge Haroche .
Sheng,Arif ame-doz kwa keja.
English,Great case and great price!
Sheng,Buda wame-kam tao.
Sheng,Manzi ame-omoka base.
English,After use it gets a plastic film around the mouth piece other then that it a water bottle
Kikuyu,[1]na imwe nĩ ciĩheaga irio cia kũhaarĩria ikũyũ.
Kikuyu,Los Angelescity irĩa nene yaUSA.
English,Fits well but don't like the fuzzy lint. I'll probably be donating it soon.
Sheng,Mbogi ana-zusha mtaa.
English,Sometimes have to squeeze together to charge phone but it works good
Kikuyu,"Rochester(/ˈrɒtʃɛstər,-ɪs-/) nĩ gĩcagi kĩa New York na nĩkuo gĩturwa kĩa Monroe County."
Sheng,Karao ana-zusha kwa matha.
Swahili,"Katika kuanza kwa uzalishaji , asilimia 78 ya michakato hizi muhimu zilikuwa kwenye udhibiti ."
English,"Received this light set as a gift from my daughter and am impressed. Exceeded most expectations: better quality, replaceable, available bulbs, when one goes out, others stay on, provides satisfying illumination at night to enhance your patio time with friends--but not blinding. I used cable ties to secure the set to umbrella supports. Only complaint is that the plastic clips attached to each lamp base are flimsy--they stretch and break easily. Otherwise, this is a five star item."
Kikuyu,City ya Uychi irĩ igũrũ mũno ta 458 m.
Kikuyu,"Gĩkoinĩ mũro wa ngora(gĩtambaya), ũhũthagĩragwo gũkua mwana kuku kana mwambĩko  wamwĩrĩwa mũkuwi."
English,My husband says he smells like a pine tree.
English,Like it a lot. Just what I needed.
Sheng,Huyu boy ame-omoka kwa matha.
Swahili,But i ' m but i don ' t i with any judge napita mtu mwenyewe hapo
Swahili,I don ' t think i would like hiyo ni aina gani
Kikuyu,Suifenhecity irĩa nene yaChina.
Kikuyu,Jackie Chan(ũrũĩa aciarirwo 7 April 1954) nĩ mũtheki thinema naMũthekaniakuumaChina.
Kikuyu,Njata kũrathũkaNjata irathũka na matũini ikoneka tarikugwa iragwa.
English,They fit great at the waist band. But it says long legged and they are not. they are real short and ride up very easily .. very uncomfortable because I have to keep readjusting them
English,Same as the ones I’ve used in classes. Should last a long time.
Swahili,"U will need to take care here , as there may be walkers on the road , especially at lunch time kila mtu , ocha kwa a na sandwich ."
English,I got this for my husband who has trouble sleeping due to joint pain. Seems to be working perfectly!
Swahili,"Kama hivyo , kwa nini si mazoezi sawa wakati mtu pozi swali ni mwandishi ?"
English,Love them so cute and squishy. Just very expensive on amazon vs the actual website for them
Swahili,Pia hazina hiyo inahitaji idara za kufichua matukio ya irregular fedha unaotokana na tuzo za faida za kuipotea na ulaghai kwa wanaodai .
Swahili,"Barua katika mkono wa murderer wa murderer , mes amis !"
Swahili,"Nguvu , kuwa na uhakika , alileta faida nyingine kwa urithi wa kike wa kike , kwa hivyo wanawake naturally kama kuwa na nguvu ."
Swahili,"Nikiwa na dole la mwisho katika kinyang ' anyiro na sawa na clinton katika dola za kampeni , mapambano ya kufafanua chaguo hilo will ."
Sheng,Karao ame-doz kwa matha.
Swahili,"Kazi ya jumla ya ajira kwa boilermakers inafaa kuwa nzuri sana , kwa kuzingatia kazi umba na mkakati wa multipollutant na kazi kwenye mimea mpya ya nishati ambayo ni zaidi ya miaka 20 ijayo ."
Sheng,Donda tuna-chill mtaa.
Swahili,"Kama jodie t. allen katika slate mwaka 1997 , kazi ya msingi ya maafa yoyote ni ya faneli nguruwe kwa majimbo muhimu ."
English,Exactly what I expected!!
Swahili,Well yeah i ' ve used them kiasi saa zingine
Swahili,Yeah they ' re sure pata kwa haraka ati babe wassenberg hakuwa ni
Sheng,Mbogi ana-dai area.
Kikuyu,Ona mĩgithi nĩkuaogwo nĩ kamagĩra cia mwanya.
Kikuyu,Thĩ nĩ ya gĩthũrũrũko ta mũbira.
Swahili,La cetellana na eoseo de recoletos ni continuations kaskazini mwa boulevard ya prado ya bourbons .
Kikuyu,"Ceceni ici no taNjata TV, Inooro TV, Gikuyu TVnaKameme TV."
Kikuyu,yaarĩUugewacacĩte hingo yaŨtetiwaUnited Kingdom (UK)kwĩthengia kuumaNdundu ya Rũraya (European Union)
English,Works perfectly in my porch light.
Sheng,Ma-dem ame-omoka kwa keja.
Swahili,"Don ' t worry , kijana we ' ll keep you vivified kwa kiasi hadi sign changes. but he didn ' t sound aniletee ."
English,Its a nice necklace looks a little cheap and was broken when i finally received it
Swahili,Are these yeah yeah i was going to say they ' re getting to the age mahali unafaa kuwa hiyo kidogo yeah
Swahili,"Bado alikuwa amevaa kitu kwa kufanana kufanana na kanzu fupi ya hospitali , na green ya kijani na baadhi ya mmea wa mmea fakhari , na kwa clasp ili shikilia pamoja na umbo la fedha za fedha za fedha ."
Kikuyu,No gũkorũo kũrĩ mĩgambo mĩnene ya kũina kana mĩario mĩraihu na ĩtarĩ na ciugo gĩtaũ.
English,This cover looks great and neat on recliner until you sit on it. It then gets messy looking
Swahili,"[ speaking ] : vizuri , subiri sekunde -- sio wote ."
Sheng,Ma-dem ame-omoka downtown.
English,Nothing like real pickle juice
Sheng,Karao ina-bamba mashinani.
Swahili,"Kwa sababu ya turow , sisi sanduku la kuuliza kuwa kila kitabu kuwa tofauti , haraka iwezekanavyo -- kwa hivyo , amazon akaacha maagizo haya au kwa kweli inahitajika siku 11 kamili ili kupata turow kwetu ."
Swahili,Mtazamo kutoka kwenye deki ya uchunguzi zaidi ya 300 ft juu ni panoramic lakini wala jitihada .
Kikuyu,Igoti riri riukaga rina rangi uhanaine na rangi wa mubuto.
Kikuyu,City ya To‘rtko‘l irĩ igũrũ mũno ta 85 m.
Sheng,Mbogi ina-bamba tao.
Swahili,Na aerobics hapo nyuma na i ivo coz i like the group association unajua kama kufanya mazoezi na watu wengine
English,I followed the size chart and it was still small ::(
Sheng,Mbogi tuna-chill kwa keja.
Swahili,"Vivyo hivyo , usafiri wa hewa hutolewa chini ya mkataba , na kitovu cha kupanga kwa barua ya moja kwa moja inaendeshwa chini ya mkataba ."
Kikuyu,Huanghuacity irĩa nene yaChina.
Swahili,Oh nina marafiki wengi ambao ni moshi tu unajua mara moja kwa pamoja kwenye sherehe au kitu wewe na hata mimi naogopa kuwa karibu .
Sheng,Mbogi ame-doz job.
Sheng,Buda ana-zusha tao.
English,"I read the first book in this series, and liked it alright. This book seemed VERY heavy on characters that I really had no desire to know, and was pretty much unable to keep up with, and didn't care anyway. This town has few redeeming features and some very unlikable people in it. I couldn't even generate much sympathy for the two main characters in the story. I may be done with this series."
English,They just didn't fit my granddaughter right
Swahili,"Je , unajua wewe kodi watu ambao wana wengi na watu ambao hawana kitu chochote pata bure ?"
Swahili,Kumbe hujambo mary
Sheng,Karao ame-doz chuom.
Sheng,Donda ana-zusha kwa matha.
Sheng,Ma-dem wame-kam kwa keja.
Sheng,Arif wame-kam mtaa.
English,It seems that the holster faces the opposite direction of what you want for a right handed draw. This is of no use to me and I wish I had returned sooner.
Sheng,Manzi wame-kam tao.
Kikuyu,Yinchuancity irĩa nene yaChina.
Swahili,Uh-huh na lakini basi sana biashara
English,"Easy to put together but if anyone sat on it, it would tip over."
Kikuyu,Kuma hĩndĩ ya tene Mũgĩkũyũ nĩ arĩ na njĩra irĩa athomithagia mwana gũkorwo ena mĩtugo mĩega hĩndĩ ciothe.
Kikuyu,"Gĩcagi gĩkĩ nĩ ĩmwe ya iria ciambĩrĩirie gũthondekwo Amerika, mbere nĩ ũndũ wa  Rũũĩ rwa Genesee na ngurumo ya tĩri mwega."
English,"When folks relaxed slightly, their curved back pushed off the ""cover panel'. I fixed this by drilling two small holes, one on either side of each ""plastic snap-on"" . Then I passed a Ty-Wrap through each hole. The Ty-Wrap slides smoothly around the round bar."
Sheng,Arif ame-hepa chuom.
Kikuyu,"Mwaka wa 2003, nĩ we warĩ mũhariri wa mbere wa 'Kwani?'"
Sheng,Mbogi ana-zusha area.
English,"No surprises here, I like it"
Sheng,Buda ana-dai kwa keja.
English,I ordered 2sizes because ordering over the Internet you don't know which is going to fit.thats why when I ordered 2 more shirts a different color andI then knew which size to get. I didn't like the dark wine color so I bleached them to get the colored I wanted.
Sheng,Manzi ana-zusha tao.
Kikuyu,Chiroqchicity irĩa nene yaUzbekistan.
Sheng,Rasta ina-lapa area.
Sheng,Arif ina-lapa mtaa.
Swahili,"Old , kutu , kutu , ni , wote , , , . , . , . , . , . , ."
Sheng,Buda wame-kam area.
English,"These robot fish do not work! They will float along the top of the bowl. Instructions say to weigh them down, but there is no way to do that... My cat ignored the fish and simply drank the water from the fishbowl..."
English,"Nice, dainty baby book. Some of the pages are odd, like vaccination records. The pages that I don't feel like completing, I'll just cover with pictures. Plenty of pages at the end to include extra pictures or fun stuff."
Sheng,Karao tuna-chill mashinani.
English,"Arrived as described, love it!"
English,"This was perfect for my tree and decor, good price, just beautiful, thanks"
Sheng,Ma-dem wame-kam mtaa.
Swahili,Um on a lot of financial aid na mahali niko sasa i ' m only in graduate school coz wao tuition na
Sheng,Manzi ime-weza mashinani.
Kikuyu,"Mwaka wa 1943, famĩlĩ ya Maathai nĩ ĩathamĩire mũgũnda-inĩ wa athũngũ hakuhĩ naNakuru, kũrĩa ithe aakoretwo agakorũo na wĩra."
English,"For a company that bills itself as environmentally friendly it is obnoxious that they don't offer larger refill sizes. What a waste of plastic. That said, the product itself, the soap is great."
Swahili,Jaribio la vipimo vya uchunguzi katika maumbizo mbalimbali ( mfano )
English,Has a nice sound especially for it's small size. But the battery only lasts for a few hours.
Kikuyu,"[[Faili:Yvonne_Ntombizodwa_Chaka_Chaka_-_World_Economic_Forum_Annual_Meeting_2012.jpg|thumb|Yvonne Chaka Chaka arĩIstanbul, 2012.]]"
Kikuyu,Mwaka wa 2004 nĩatuĩkire mũndũ-wa-nja wa mbere kuuma Afrika kũheo Kĩheo kĩa Nobel gĩa Thayũ[1][2]
English,It doesnt work like tru vision tru control
Sheng,Ma-dem ana-dai kwa keja.
Sheng,Karao ina-bamba chuom.
English,"Pros: 4 way brightness settings along with an amazing strobe and SOS setting as well. Carry 7 days a week and use as a tool at work where they provide Streamlight and Blue Colts but prefer this for its lightweight and easy to carry. Has the pressure or lock-in on and off and can be weapon mounted. Waterproof, easy recharge and will be honest have never used the battery provided, I buy the Tenergy 18650 batteries and charge in a separate charger. I have purchased 4 all together and still have 3 working like new and I'm hard with usage and dropping them. Could not be happier with this flashlight. No cons...Period!"
Sheng,Ma-dem ime-weza downtown.
English,This item is used as a fridge water filter was easily installed and water taste great
Sheng,Msee ana-zusha base.
Kikuyu,Oqoltincity irĩa nene yaUzbekistan.
Kikuyu,nĩ ataragĩragia ũrĩa we na nyina magereire mooritũ arĩ mũnini amu nyina endagia njohi gananie ya cang'aa na ũndũ ũyũ nĩ wa maigaga na wagagu mũno.
Kikuyu,"Thinema rungu rwa ngoga 'Scarred: The Anatomy of a Massacre', ya Judy Kibingenĩyo yarĩ thinema ya mbere kũmũrĩka matuĩka ma njũragano ĩno."
Sheng,Huyu boy ina-bamba kwa keja.
Sheng,Arif ame-doz base.
Kikuyu,>> nyamũ ciothe irĩ hĩa nĩ irĩ mahũngũ [all horned animals are hooved]
Sheng,Mbogi ana-zusha mashinani.
Swahili,Mfanyabiashara huyo wakafuata pamoja na mstari wa mawazo yake .
Sheng,Mbogi ina-lapa mtaa.
Swahili,"Kwa kiasi kikubwa , maeneo ya bili mipaka jinsi fedha zinaweza kutumika ."
English,"The slippers are okay, but the arch support is not in the right spot. I do not know who designed this but I guess they did not actually study the foot. The arch support should go at the bend where your arch is. Not after it. Because of this the arch support is much further up buy my big toe and feels a bit uncomfortable until it is worn down. Luckily that happens rather quickly. Or maybe unluckily. Depends on how you see it."
Kikuyu,"Hĩndi ĩria Intel ya thondekire Cipiyu cia PI, PII, PIII, PIV na PV nĩ cia gĩre ngumo mũno."
Swahili,"Ofisi ya utalii wa ndani will kutafuta ziara za kujipanga katika mambo ya ndani ya farasi , kwa boti , na kwa jeep ."
Sheng,Donda ame-doz chuom.
Swahili,Tume pia ilirekebishwa makadirio ya mzigo wake katika majibu ya masuala raised na wachambuzi .
Swahili,Nuru alikufa nje ya macho ya bi vandemeyer .
Swahili,Sawa sawa si pia ingawa kulingana na dini. yaani sio kwamba ni nguvu halisi .
Sheng,Buda ina-bamba area.
Sheng,Karao ame-hepa tao.
English,Overall the dress was beautiful the only issue we had was the back was loose so we had to pin it up so that it would not look so loose!
Kikuyu,Matuĩka ma Arabu nĩ mĩkũĩkũ ya ũregi-ndamathia ĩrĩa ya hurunjĩte mabũrũri ma Arabu mĩakainĩ ya mbere ya 2010.
Kikuyu,City ya Los Angeles irĩ igũrũ mũno ta 93 m.
Sheng,Ma-dem ame-hepa tao.
Swahili,"Utaifa never kabisa , hata hivyo , na katika sehemu ya mwisho ya karne hiyo kumekuwa na akatengeneza ( ingawa amani ) jitihada za gain kwa ajili ya uskoti ."
Kikuyu,Kwĩ hĩndĩ thĩ ĩtoakaine ũraia ĩhana.
Kikuyu,gĩtereko gĩkinyagĩragwo thutha wa mimaniokĩrica (premise)gĩkaru na kĩrica nyang'ania.
English,Liked the product. But when I received product it was marked $4 less than what I paid. I called the sender and they would NOT budge on the price. Personally I though that was kind of Crappy! wont order from anything from them again for that reason.
Sheng,Mbogi ime-weza base.
Kikuyu,"Mũromo wake, no ĩkunĩkwo na ngĩrwa ya thĩinĩ kana gĩkunĩko kĩa nja."
Swahili,"Wao katika robo ya wafanyabiashara kwenye black nyeusi , farasi wa kaskazini ."
Swahili,Nilisema i ' m from maine kwanza i ' m not i ' m a mwenda kwa maneno mengine
English,The thing didn't even work. Nothing popped up. worthless piece of plastic.
Sheng,Huyu boy ame-doz chuom.
Swahili,That ' s i ' m glad u said it and i didn ' t have to but that that ' s i feel the exact way i sit i sit and watch some shows and uh na i kwa watu hiyo hata kwa show unajua kwa nini unafanya hivi mwenyewe
Sheng,Mbogi ame-hepa base.
Kikuyu,"Brasilia nĩ Cĩtĩ ya kiriu, kurure na kubangwo wega."
Sheng,Manzi ime-weza chuom.
English,"I love this machine! It saves me so much time by making multiple copies and cutting them itself. It takes up to 24mm tape which gives 3 lines of text. My labels look much more professional and I love the choices it gives for fonts, text size, etc. It saves files which is great for my Aromatherapy business Love From Hawaii, I won't have to start over every time I need a different label. These labels withstand my oil based products without showing damage and they come off easily to reapply without ruining. I just received it today so it has many features I haven't gotten to, yet. It came so fast, in 3 days, with free shipping! Mahalo amazon!!"
Kikuyu,"Hithitori ,https://web.archive.org/web/20111203212203/http://openfutures.jdlinsweden.se/page110.php, 2013."
Sheng,Karao ana-dai base.
Kikuyu,Thĩ  [ĩrĩa ĩtagwo'ala'kana'ụwa'na rũthiomi rwaIgbona igwetwo'ensi'na rũthiomi rwaRũganda]ĩkoragwo na icigo cia mbara nyũmũ  na nĩcio:
