Language,Text
Sheng,Karao wame-kam kwa matha.
Swahili,Motisha kwa teknolojia ya udhibiti wa emission ya kabonia
Kikuyu,City ya Meihekou irĩ igũrũ mũno ta 180 m.
Swahili,Ofisi ya kaunti ya passaic na wafuasi wake ona tofauti .
Kikuyu,njiarano nĩ mũtaratara ũrĩa kĩũmbe gĩkengũraga kĩũmbe kĩngĩ ta kĩo.
Kikuyu,Physics itagwo na gikuyu fithĩki.
English,"This is a terrific product, best stain remover I've ever used, even removes blood stains. But don't buy from Amazon. They threw this into a box with four other products and no packaging around the items. Nearly all the stain remover leaked out from all three bottles. The other items were covered with the thick stain remover liquid and the bottom of the box was saturated with it. A big mess to clean up. Amazon made it right and shipped a replacement but I won't order again."
Sheng,Msee ame-hepa area.
Swahili,Sawa kabisa .
Kikuyu,Tekinoronjĩ kana ciaga cia nyamũ cioyaga sigino kuma kwi macingiriria na gucitumira njikithithira(Effectors).
Swahili,Lakini sisi fursa yoyote ya kufanya uamuzi kama kwa sisi tu iwapo si chama kilikuwa na hatia .
Kikuyu,[1]Nĩ kũrĩ na mĩthemba 100 ya koikoi ĩrĩa ĩgomagĩragaandũ.
Kikuyu,"Indo cia ndũyũ, ngari, mĩkawa, honge ciaNdamathia, na nyũmba cia ndini nĩ imwe cigomagĩragwo hĩndĩ ya nditimũrano."
English,I replaced my Phillips hue lights with these because I couldn’t get them to work outside and I must say these lights are fantastic they work just like wonderful from sunrise to sunset.
Swahili,Deri ' s ilikuwa karibu dakika kumi tembea kutoka kwa mlango wangu wa mbele .
Swahili,"Baada ya maafa hayo , mycenean greeks kutoka kwenye peloponnese ulihama ili kudhibiti kile kilichobaki katika makazi ya minoan wanaweza hata kuwa na uharibifu wa uharibifu ."
Swahili,Kuna punje chache za ukweli katika hadithi hii .
Swahili,Anakumbuka kuwa katika safari moja ya poland yeye marafiki wa ndani ya ajenda ya hawaoni kwa kusisitiza amri kumi .
Sheng,Ma-dem ame-hepa mashinani.
Sheng,Buda ame-doz kwa matha.
English,The boxes are great but came missing one lid!
Sheng,Ma-dem ana-dai area.
Sheng,Buda ana-dai base.
Kikuyu,No mahũthĩre mĩkebe ya ndogo ya maithori kũcerehũra kĩrĩndĩ.
Sheng,Donda ina-bamba mtaa.
Swahili,Sasa hivi sisi glass kwa miaka maana miaka kwa sababu tuna kiwanda cha vioo katika jamii yetu
Kikuyu,"Na gĩkűyű no ĩtwo űthuthuria wa gűtűmira űhoti, iremethia, mieke na iguoyohia."
Swahili,Hilo ni ubepari wa soko kwani .
Swahili,"Aurangzeb inataka utawala wa ulegevu wa watu wake wa zamani , lakini karibu bankrupted ufalme na kampeni zake ili kupanua himaya chini ya kusini , na vita vyake dhidi ya waasi kaskazini ."
English,I usually take an extra large. These leggings fit but they are really tight around the waist. I never had a problem with any of the other brands--won't be ordering from Lush Moda again
Swahili,"Uwezekano mmoja ni kwamba matangazo haya will kwenye fomu mpya ya micro , lakini mchakato will bila suala wapi ."
Swahili,"Nguo zake , ndevu zake , miwani gani macho yake hizo ni alama za salient kuhusu muonekano wake binafsi ."
English,Way to difficult to get over my head I misunderstood the front closures purpose. I ordered 2x way too small very disappointed oh well I learned something.
Swahili,"Nyota inayoibuka , hakuna maudhui tena kwa kucheza nightclubs ndogo , alikuja las vegas kwa ndoto za kufanya ni kubwa ."
Kikuyu,"City ya Yinchuan irĩ igũrũ mũno ta 1,100 m."
English,"Great product so far! Got it before day expected to arrive. Good, good!"
Sheng,Mbogi ana-dai kwa matha.
Kikuyu,Ici nĩ ngari itűmagira thitima handu ha maguta.
Kikuyu,Nĩ aahengerirwo nĩ New England Patriots kĩharoinĩ gĩa kana kĩa NFL Draft ya mwaka wa 2001.
Swahili,Mazungumzo yataendelea aprili 13 .
Swahili,Ni lazima alfred inglethorp. poirot alitikisa kichwa chake kwa umakini .
Sheng,Manzi ana-dai kwa matha.
Swahili,Hiyo ni what ' use the force ' ni
English,"This was my child's favorite toy she got for Christmas... for 3 weeks. Then it broke in half. She is 3.5 and a confident walker, so this is not an issue of undue pressure on the cart. The legs snapped in half. Same spot and issue as almost every other complaint. It is not worth the money saved when it is only used for 3 weeks. Either don't get a shopping cart or splurge on a better quality one. Just don't waste your money on this one!"
Sheng,Buda ame-hepa tao.
English,"Usually amFilm is my go-to for screen protectors, been buying them for years. However, these LG G7 ones have slipped and even fallen off after even a short fall (like from the couch to the floor). Only the thin black frame is sticky, so there's really not much holding it on. I don't drop my phone often, but still... I need something that adheres to the entire screen, not just the edges."
English,"Too big for espresso spoons, but go with gold trimmed espresso cups"
Swahili,Kijana that ' s inatisha sio ?
Swahili,Mashujaa wa movie ni mwanaume na mwanamke nani mfumo na baby wao na wanaenda kuishi kama familia ya kienyeji .
Sheng,Karao ina-bamba kwa matha.
Sheng,Donda ime-weza mashinani.
Swahili,"Barabara mpya alileta mashindano kutoka nje ya eneo hilo , ambayo broke ukiritimba wa ndani wa plot ."
Kikuyu,Maundu maria biacara kana mundu atahotaga gwika kana gwika wega
English,Exactly what I was hoping I would get.
English,"Everything is always wide and clear in my monocular. I can see long distances very well with them. Overall, this is a great telescope with reasonable price!"
Sheng,Buda ame-omoka mashinani.
Kikuyu,"Nĩ kũrĩ cia mahunjio taFamily TV, Hope TV, Sayare TV na Aviation TV."
Sheng,Manzi ime-weza downtown.
Kikuyu,"Jones aakuire Colorado Juni 9, 2018, arĩ na mĩaka 39."
Swahili,"Naam , na sana na majukumu ya wanawake katika kazi ambayo ni nzuri i guess kuwa na mitazamo ya mwanamke na uh kwa namna mambo ni katika kazi hasa katika wa aina kazi ambayo nadhani ni labda bora juu ya mkono wa wanawake kwa ajili ya faida za uzazi na vitu kama ambavyo wanawake pengine wanaelewa kuwa bora kuliko wanaume don hivyo nadhani ni nzuri"
Kikuyu,Muciĩ mũnene wa South Abĩrika nĩJohannesburg.
Swahili,"Kambi hiyo ni muda mzuri sana inaonekana kukutana au kufunika aina nyingi za aina mbalimbali za uh , juu ya safari za usiku au wakati mwingine hata si usiku , jambo lolote kutoka na kile ambacho unaweza kubeba kwenye mkoba wa mgongo. labda hata tent ."
Sheng,Huyu boy ana-dai mashinani.
Kikuyu,"mabataro ma kũrungo ka mbere nĩ: ũgima wa mwĩrĩ, wĩĩra, ng'ũndũ na wagi wa wagagu itũra-inĩ/ũrangĩri"
Sheng,Huyu boy ina-lapa base.
Sheng,Donda ame-hepa job.
Swahili,"Kwa wingi wa beachfront , mgahawa wa kifaransa wa juu ( la mer ) , na nyumba ya maeneo bila lounge ya nje ya vinywaji ya machweo , halekulani ni resort kamili ."
Sheng,Huyu boy ame-hepa kwa keja.
Swahili,"Quay ya mbao , katika benki ya kusini ya mto ( downlod kutoka kwa arch na yametawala na ofisi za featureless za shirika la dublin ) , ni tovuti ya makazi asili ya viking na burudani yake ya kijanja , tukio la viking ( jumanne jumamosi 10 asubuhi ) saa 4 : 30 jioni , imefungwa jumapili na jumatatu ; watu wazima ira4 ."
Kikuyu,Mũciĩ mũnene wa Israel nĩJerusalem.
Kikuyu,"Thĩinĩ waũgĩ wa muoyo, kambĩ nĩ ngarana yaKabĩcia mĩthemba ũmwe na kĩrĩra kĩmwe."
Swahili,"Kwa jua hilo gone na nyota rocking kuwa na kizunguzungu , hakukuwa na usiku wala mchana , wala njia yoyote ya kukisia mapito ya muda ."
Kikuyu,Nĩ ĩrĩ na bata mũno harĩ ũthimi wa ũraihu wa rũũĩ.
Kikuyu,City ya Guilin irĩ igũrũ mũno ta 153 m.
Swahili,"Kama kama swali lake , kulikuwa na ghafla , coruscating wa kutoka juu ."
Swahili,Ni aina ya kuingia huko na alichukua
Sheng,Donda ame-doz downtown.
Swahili,"Wakati fulani , kupunguza unified ya shirikisho deficits au kudumisha unified surpluses kwa gharama ya shirikisho la shirikisho la r & d na elimu matumizi wasiwasi kuhusu ujuzi wa wafanyakazi wa siku zijazo , maendeleo ya teknolojia , na hivyo , ukuaji wa kiuchumi ."
Swahili,"-- kauli ya gary r bachula , kaimu katibu wa teknolojia , idara ya biashara , kabla ya sayansi ya nyumba subcommittee kwenye teknolojia , juni 19 , 1997"
Sheng,Buda ina-lapa job.
Swahili,Yeye kama farasi akamvuta tena .
Swahili,Katika sakafu ya juu ( pindi chambers ya kifalme ) kuna maonyesho telling hadithi ya royal accidents .
Kikuyu,Ikoi nĩ ĩkoretwo ĩhũthĩrĩtwo kwa ihinda rĩa mĩaka makiri maingĩ.
Sheng,Donda wame-kam kwa keja.
Sheng,Ma-dem ina-bamba area.
Kikuyu,"O ta ũrĩa cuba ĩcio ĩthiaga ĩkĩbatarĩka makĩria nĩ hakoragwo na ũkunderu wa gĩkeno,Njũgitanona mbaara."
Sheng,Manzi ana-zusha chuom.
English,The Ankle Brace fit well and I do like them. The only draw back is the hole when lacing them up do not match with the inside material so it can be a pain to lace.
English,"picked up a few ideas out of this book, made me think ("
Sheng,Buda ina-lapa chuom.
Sheng,Donda wame-kam tao.
Sheng,Donda ana-zusha mashinani.
English,Only one inside and my son wouldn't wear it on him so it was a waste of money.
English,I have a thick mattress and bought the cal king size and this is def not deep pocket. It kept slipping off so I returned it. They’re ok sheets dunno why it’s so raves about.
Sheng,Manzi ana-dai tao.
Sheng,Rasta ana-dai mashinani.
English,"I had a problem with my all-in-one printer and was able to describe it, file a claim, and receive approval within a matter of minutes, all online."
Kikuyu,Ceceni nyingi cia guku bururi-ini cinyitanĩirie maũndũ maya hamwe.
Sheng,Msee ame-omoka downtown.
Sheng,Manzi ina-bamba mtaa.
English,We purchased it bigger since reviews stated so. Wear womans size M but purchased a large so it could be baggy. My teenager loved it and I may not get it off of her
English,"Dislike Product, Did Not STAY in Place, was not secure fit."
Swahili,"Na milima na milima ikaondolewa , na mabonde , na mizaituni , na mizaituni ."
Kikuyu,"Aakuire thutha wa kũgĩa na mathĩna ma kansa ya matumbĩ mweri 25 wa Septemba mwaka wa 2011""."
English,I got this thinking it’ll be a quick fix for my recently damaged hair but I quickly learned that it works BUT I feel like it isn’t worth the hype or money.
English,The stickers were a gift for my 11 year old nephew. Based on previous reviews I also purged and removed a few inappropriate ones prior to gifting. Otherwise he loved them.
Swahili,"Uongozi ni kuwa mjanja , hard-working , na kuchora kazi bora kutoka kwa timu ."
Swahili,Lakini jaribio lake la characterize bodi ya uhariri ya ukuta wa mtaa wa ukuta kama uadui uadui kwa taxation husahau kwamba watu wa jarida hilo wapo katika kampuni nzuri .
Swahili,"Epa ana taarifa ya sheria ya mageuzi ya , ya , na ripoti yake kwa ofisi hii ."
Swahili,"Wanawake wawili na mwanaume mmoja , au wanaume wawili na mwanamke mmoja , na mmoja , mtoto mmoja tu , ambao watu wazima take katika mfumo wa hama tatu ."
English,"Loving these! The only downside is that you have to remove the wrap around bit of leather when you put them on, so if you are in a hurry, probably best to have a backup pair that take less time to throw on."
Kikuyu,Ruichangcity irĩa nene yaChina.
Kikuyu,"Kenyatta Lapoleon Jones(January 18, 1979 - June 9, 2018) aarĩ mũthaki wa mũbira ya nũndano wa Amerika."
Sheng,Arif tuna-chill downtown.
Swahili,Kumbe ni rahisi kwako uende .
English,I took the suggestions and bought a size up (large instead of medium) and they turned out to quite baggy. Should have stuck to my true size.
Kikuyu,Margilancity irĩa nene yaUzbekistan.
Swahili,"Ndio , ikiwa ni pamoja na bwana maarufu mouny ( nani maelezo ya mwisho ya uhuru na kizuiacho hapa mwaka 1947 ) , made mtaji wao wa majira ya kiangazi ."
English,"Watched the tutorial video and this is way overcomplicated to put on. It has u put water on the screen first. I still cant get all the water out from underneath my screen protector. Also the protector is 2 or 3 mm smaller than the size of the screen, making it difficult to center properly."
Sheng,Karao ame-doz mashinani.
Sheng,Rasta tuna-chill area.
Kikuyu,"Nditimũrano kana ngũĩ ya mũngĩkĩ nĩ mũthemba wa  gahĩha ya ngumbacũ ĩcũngarĩrĩria kagĩĩri kũũkĩrĩra na kũhũnga ũgwati ũtongoria wao, andũ na ndũnyũ."
Kikuyu,Magoti makoragwo mari maraya na moko maraihu kana makuhi na mahingagwo na nyororo kana ibungo iria iri mwena wa mbere.
English,Just like description
English,Good for cute puppy art that we are making but some of them were flatten. I need to puff it out.
Sheng,Manzi ime-weza base.
Swahili,Kuna njia nyingi tofauti za kukamata samaki wewe usiku unaweza
English,"I love this. But I can’t use it, and here are the reasons: PROS: -Color true to the picture. -Arrived on time with no scratches. -Closes perfectly (not loose like some flimsy stuff). CONS: -the bag part is veryyyy small and would only hold a phone . It should be called a belt with storage but definitely NOT a bag of any sort. So, I was going to wear this on my trip to the beach but it didn’t fit anything and I had to carry my big bag to be able to hold some cards.... I still loveit and wear it as a belt = )"
Kikuyu,Kĩugo 'cuba' kĩumanĩte na ngerũra ya kiugo 'buca' kĩrĩa gĩkoragwo na nongorio ya 'kũgera handũ harateretha kana kũnyororoka mĩtũkĩ'.
Swahili,That uh was a real good to do it was it tough but uh yeah wengine ama ni zaidi tu msalaba
Sheng,Donda ame-omoka kwa keja.
Sheng,Rasta ina-lapa mashinani.
Swahili,"Wasichana hao wield matawi ya mti mtakatifu wa sakaki na dance kwenye bendi ya orchestra ya mbao ( hyoshigi ) , giza zither ( higa ) , kiungo cha mdomo ( sho ) , na oboe-kama hichiriki , pamoja na mavhudzi na ngoma ."
Swahili,"Kama kuonyesha katika sehemu ya awali ya karatasi hii , hata hivyo , kiwango cha ustawi wa net ya jumla ya taifa linaendelea kuongeza baadhi ya punguzo hapo juu ya 6 a ."
Swahili,"Moja mbele ni ndogo st chapel ya margaret , alisema kwa na david. mimi katika karne ya mapema ya 12 kwa heshima ya mama yake , malkia margaret , ambaye alifariki mwaka wa 1093 ."
Kikuyu,Terebiceni(kana 'runinga' na rũthiomi rwa Gĩthweri) ni mūtambo ũhũthĩkaga harī gūtūma ndūmīrīri cia mbica irathiī.
Sheng,Rasta ana-zusha area.
Sheng,Donda tuna-chill kwa matha.
Sheng,Karao wame-kam tao.
Sheng,Donda ame-omoka base.
Kikuyu,Kaingĩ kũhiũrania na ngũĩ nĩ wĩra mũritũ mũno kũrĩ mbũtũ cia karaũ.
Swahili,"Pindi wewe juu ya eneo la juu la hardknott pasi , eskdale afunguka mbele yako ."
Sheng,Huyu boy ana-dai area.
Swahili,"Na , zaidi ya hivi karibuni , viongozi wa kikristo wa kikristo na reed kwa ajili ya upuuzi wa kampeni ya bob ya bob ."
Sheng,Mbogi ame-doz kwa matha.
Swahili,"552 ( 1994 ) ) , kufutwa mahitaji ya makosa au ya ajali na badala yake iliyotolewa fidia hiyo ni wapeni kwa wote lakini hizo majeraha ambazo ni fulani , au karibu sana , matokeo ya matibabu ya matibabu ya alituhudumia ambayo ni ridhaa ya wakongwe. kabisaa ."
Swahili,"Salvatore kubwa ya salvatore , nyumba mpya ya mtende , ni na pamberi na mitende na mitende ambayo kustawi katika mazingira ya joto , mazingira ya kibarani ."
Kikuyu,Thayathi cia mũthingi cia ndũire nĩ:
English,"These are really cute!! Then one set I thought would be metal but they aren't, they're plastic but I mean for the price you can't really beat it. You get 18 pairs of gauges. These did a lend up being to small for me 😕"
Swahili,Pwani hapa ni yote lakini tena .
Sheng,Msee ame-omoka tao.
Swahili,Alikuwa na askari wa zamani ambaye wange kulinda kijiji chake .
Swahili,"Na wa magharibi wa italia ni na visiwa viwili vya mediteranea , sardinia na sicily , rugged , ajabu , na , katika historia ."
Kikuyu,Mũthaki Xi nĩ acokaga kũhũndũra cuba ĩyo kũrĩ ũtũro wa kĩroho thutha wa kũrĩteyania 'mũthia-inĩ waThĩ'
Swahili,John mccain ilivyoainishwa kwamba ni vyombo vya habari na watu wa marekani nani maswali gani should .
English,"No assembly was nice. Made in America 👍🏻 Arrived in open box, one bent stake which I managed to straighten, no packing slip (probably due to completely open box) Perfect addition to the garden. Would purchase again."
English,When I started wearing this product my skin got rash and itched it the area that caused me and irritated spending and getting worst. I don't know why this product has this problem it costs me other money to my the medicine for itching and getting a rash. My skin got pilled when I itched the area and it causing me a lot of problem with this product.
Sheng,Buda ame-doz tao.
Swahili,"Nyati wa ruminative akivuta likilima na mikokoteni , kisha wallows katika matope ya bwawa la kijiji ."
Sheng,Karao ana-zusha chuom.
Swahili,"Lililotapakaa , snider , kama , kama , , , , , . , . , . , . , . , . , . , . , . ,"
Swahili,"Czarek noticed kwamba jamaa kadhaa walikuwa wanakunywa bia za ndani , na katika mwendo mkubwa akamvuta chupa ya pombe ya palissander , lakini hakuna mtu pwa umakini , kwa sababu elwak amehifadhi :"
English,I ordered small and they gave me extra large
Kikuyu,"Kaingĩ nĩ ũkoragwo ũcũngĩrĩirio na maũndũ mega ũtũũro-inĩ, ta kũhingia mĩoroto, kũgĩa naandũende, kana kũhũthĩra mahinda na maũndũ mega."
Sheng,Manzi ame-omoka chuom.
Kikuyu,Nĩũndũ ũcio kambuni ta Disney nĩ igũthie  na mbere gũkorwo ikĩnyita itemi inene mũno hari ũreri wa ciana cia mahinda maya tũrĩ.
Sheng,Buda tuna-chill job.
Kikuyu,Kaingĩ indo iria itarĩ mwene nĩ nyuranyura.
English,"Would have given a better review, but package came without two hook parts that are needed for assembly."
Sheng,Buda ime-weza base.
Kikuyu,Nĩ aamenyekire mũno nĩ ũndũ wa kũruta mbica cia woma cia kũgegania iria irĩ na maũndũ ma gũkenia na ma gũthekania.
English,Easy set-up and convenient wine dispersing. I use it with reds.
Sheng,Arif ina-lapa area.
Sheng,Ma-dem ina-lapa area.
English,It has a potent smell but it really does soften up the beard. After I use it longer will update as to growth results.
Kikuyu,4.Mũrarachi (Calodendrum capense)
Swahili,"Hata hivyo , timu hiyo walitumia mbinu , learned katika warsha ya cap , kwa kuchambua na kuongeza viwango vya mdau vya mdau ."
Kikuyu,"Rũiyũkagia cuba ĩcio ta utũgi kuma makai na gũhũthĩra ta mũũro wawĩini, mũũro wa kũmburia mĩthaiga na kabirũ."
Swahili,Mapinda not extradited kwa spain
Sheng,Mbogi ina-bamba kwa keja.
Kikuyu,thukuru ici nĩcio cia gĩkero kĩa gacũmbĩrĩ mũtarainĩ waMathomo.
English,"Bought this to handle a few games with tons of keyboard options and have not been disappointed. It took me a couple of tries (probably user error) to get the driver installed properly but once I did the device and accompanying software work great together. The backlit keys are fully configurable and, if the game supports it, will flash to indicate things like low health or level up. All in all a great little device."
Sheng,Rasta ime-weza job.
Kikuyu,Ona kũrĩ ogwo kũũra kwa kĩũga gĩkĩ kĩaririmbũrauucũ na ndũikũrĩ mũtirike.
English,This item was sent to me damaged. It seems as if it was already worn. Don’t waste your money on it.
English,"The sizing is not just right. Said in th listing that it stretches. Well, I don’t think that the case. The pants I can’t use it cos it keeps falling out of my wasit."
Sheng,Ma-dem ina-lapa chuom.
Sheng,Ma-dem ame-doz tao.
Kikuyu,"Nĩhakanĩte na mabururi ma:Botswana,Zimbabwe,MozabiquenaNamibia."
Kikuyu,"Mabũrũri-inĩ maingĩ, indo iria ciendagio gatĩna gaka imemerekagio nyũmba cia mũhoro ona ndũnyũ-inĩ."
English,Submerged the light in less than a foot of water for a few seconds and it died. The conductor inside also fell out on the first day of use.
Swahili,"Leo , fort ya karne ya 15 ya qait bey nyakati juu ya kiingilio cha bandari ."
Kikuyu,Mbogo nĩ ya kĩrathi kia Mammals kia Baoyorojĩ.
English,This case is super cute
Swahili,"Hakuna miti na hakuna shrubs , 15 stark miamba alipamba na moss ya kale , kusimama katika matunda katika changarawe ya white changarawe ."
Swahili,"Kwa mfano , absorber kumi ingeliweza kushughulikia capacities ya 2000 mwe na 3000 mwe katika vituo viwili walikuwa wakati wa desemba 1995 ( agizo akaweka ) kupitia machi 2000 ."
Kikuyu,"Kaingĩ nĩ ĩheagwo nĩguo mũrutwo ahotithie gũthiĩthukuru, kĩũratĩna kanaũcekĩmarĩrĩa angĩremwo nĩ gũthiĩ ũguo."
Swahili,Makavazi ya sanaa karibiana ikulu ya madirisha ya 55 ina mkusanyiko wa thangkas wa zamani na mfugaji katika mbao na jiwe .
English,I never was able to use it. Put it all together tight had my venison cut into little cubes turned it on and the motor was making an awful sound.
Sheng,Huyu boy ame-doz job.
Sheng,Ma-dem ina-bamba downtown.
English,"The box is totally destroyed! Talk about a Crunch! The box is a mess! It’s not the blame of UPS..,it’s gotta be at the Amazon loading facility"
Swahili,"Maui alianguka kwanza , wakafuata na kwathu , lanai , na molokai ."
Swahili,"Marguerite na sanduku lake la jewels , eneo la kanisa , siebel na maua yake , na faust na gikilig ."
Swahili,"Je , una faida gani katika kazi yako ambayo unafikiria ni muhimu sana"
English,I bought this as a gift so I do not know how they like it but it came fast in great condition!
Kikuyu,[1]thabai/ hatha - stinging nettles.
Kikuyu,Cairo( カイロ na rũthiomi rwaNjabani) nĩ mũciĩ mũnene wa bũrũri waMiciri.
Kikuyu,Mbogo(گاومیش na rũthiomi rwaIrani)
English,"I love this light. The remote control is amazing, no having to jump out of bed to get the light or change the light setting. The remote control is not back lit which sucks at night in a dark bedroom, but easy to get used to where the buttons are over time. I cannot attest to longevity as I have only had it for a week. Box came very well packaged and it is quality. The light gives off a natural light unlike the Nicrew model I returned. For $30 more this is much better. There are several settings that look alike so useless, No actual ON/OFF switch so good luck if you lose the remote or it stops working. I have it on a switch as well in case I dont want to find the remote. 2 different black light settings and a couple in the middle which are very nice. Over all it is not cheap but lighting in a tank and ease of use is critical to me so I am happy and i recommend this product"
Sheng,Mbogi ina-lapa area.
Swahili,Wao mbinu rasmi na miundo hiyo uwezo wa biashara zao na teknolojia ya habari na viongozi wa usimamizi kuelewa na kuwasiliana na masuala moja ya anotheras na kufanya kazi kwa pamoja ili kutimiza maono ya biashara ameshiriki .
Swahili,Ni aina mbaya na ?
Swahili,"Upanuzi wa usafiri wa hewa ulianza umri wa utalii wa misa , na ugiriki pamoja na visiwa vya aegean ikawa mafikio kwa ajili ya wazungu wa kaskazini kukimbia kibarani yao , cool cool ."
English,"I used it to give it to my older daughter, since im having another girl"
Sheng,Rasta ame-hepa mtaa.
Kikuyu,Laohekoucity irĩa nene yaChina.
Swahili,Uwezo wa carp wa kupambana na upstream dhidi ya sasa imara ni kama kielelezo cha fit kwa vijana wa kijapani .
English,9 months later still never recieved this. At no fault to the company btw. Amazon lost the order and no one will remedy this.
Kikuyu,City ya Boston irĩ igũrũ mũno ta 43 m.
English,Fantastic psychological thriller. Grabs you from the very beginning and never lets go. Will definitely read other Shalini Boland books.
English,"It was working amazing before I washed it. Unfortunately after the first wash it no longer works nearly as good as before. Even if I put it on the highest setting, it barely heats up. It really is a disappointment. Honestly I’m really scared to wash it a second time because it doesn’t really heat up as it is."
Swahili,Hiyo yote ni missing ...
Kikuyu,City ya Hejin irĩ igũrũ mũno ta 396 m.
Sheng,Rasta ame-doz downtown.
Sheng,Manzi tuna-chill base.
Swahili,Yeah i can ' t ride bike kumbe
English,"I've always been a fan of CatEye products but this just seem too small for me. As an eyeglass wearer, the small size made it difficult for me to read while riding and even more difficult with single (long distance) vision prescription sunglasses. I ended up getting a larger computer for my biking needs."
Sheng,Rasta tuna-chill mashinani.
English,"Cute concept, but my husband wears an XL and this XL was too small for him - too tight."
Sheng,Mbogi wame-kam job.
English,Looks cheap and plastic. Not happy.
Sheng,Donda ame-doz base.
Kikuyu,Poznańcity irĩa nene yaPoland(Borandi).
Sheng,Mbogi ame-hepa chuom.
English,The sweater would be better if it had a hole for the harness to attach to leash.
Kikuyu,Maũndũ maya mothe mathomithanagio kũhĩtũkĩra ng’ano na kĩrĩra kĩa rũrĩrĩ.
English,Nice and small set up to get all those little jobs done without taking up a ton of space in my cupboard. Easy to operate and looks quite sleek.
Kikuyu,Chortoqcity irĩa nene yaUzbekistan.
English,You sent me an EMPTY BOX. I returned the empty box to you. Now you aren’t refunding me!!!! I want this fixed immediately. Thank you
English,Went bad after a few years. WHY? This should last a long time!
Sheng,Karao ana-zusha job.
English,Great ornaments for someone who likes woodland creatures or owls. Bought for sis in law and she really liked them. Giving it four stars only because they are a bit cheap looking. They are plastic and shatterproof. Product was as described and arrived on time.
English,Stays hot or cold for hours.
Kikuyu,>> socrates nĩ mũndũ -kĩrica gĩa keerĩ
Swahili,Uh yeah very yeah hakuna mengi hapo unajua
English,Where is the strainer you promised with my order
Sheng,Karao ina-lapa mashinani.
Swahili,Sasa unaweza kuoa msichana tajiri .
Kikuyu,Kaingĩ andũ nĩ makoragwo na nditimũrano tondũ wa icaya rĩna kana kwaga kwĩtĩkĩra ũndũ mũna.
Kikuyu,"Imwe ciambicaanathaka nĩ hamwe na '我是誰'(Niĩ ndĩ ũ), '奇謀妙計五福星' 'Winners and Sinners' (Ahotani na marĩ Mehia) na  '飛龍猛將' (Ndamathia Mĩndĩ na Mĩndĩ)"
